Group,ID,BarCode,Type,Brand,Line,Unnamed: 6,New arrivals,QTY,EUR,BGN,Best Price,Unnamed: 12,Our Price,Image 1,Image 2,Image 3,Image 4,Image 5,Video,1. Captivating Headline or Tagline,2. Sensory Introduction (1–2 sentences),3. Key Features or Ingredients (Bullet Points or Icons),4. How to Use (Optional but useful),5. Emotional or Lifestyle Hook,6. Tech Specs or Product Facts,FAQ,7. SEO Keywords (Behind-the-scenes),✅ Tips for Beauty Product Pages
Парфюми ,34589,3760022730664.0,Clean EU,Juliette has a gun,Juliette Has A Gun Moscow Mule (U) EDP 100ml,,New,42,€38.50,lev75.30,lev104.60,,99.37,,,,,,,,,,,,,,,
Парфюми ,37168,3607342221161.0,Clean EU,Marc Jacobs,Marc Jacobs Daisy So Fresh (L) EDT 75ml,,,10,€38.50,lev75.30,lev88.00,,97.89 ⚠️ Too Low!,,,,,,,,,,,,,,,
Парфюми ,41650,850049716314.0,CLN,Michael Kors,Michael Kors Pour Femme (L) EDP 50ml,,,42,€38.50,lev75.30,lev105.00,,99.75,,,,,,,,,,,,,,,
Парфюми ,22851,8435137749591.0,Deco,Prada,Prada L Homme (M) EDT 50ml,,,157,€38.50,lev75.30,lev104.00,,98.80,,,,,,,,,,,,,,,
Парфюми ,40031,3614273556187.0,Deco,Prada,Prada Luna Rossa Ocean (M) EDT 50ml,,,41,€38.50,lev75.30,lev113.90,,108.21,,,,,,,,,,,,,,,
Грижа за кожата,24336,768614103202.0,CLN,Shiseido,Shiseido Bio-Performance Advanced Super Revitalizing Cream 50ml,,,112,€38.50,lev75.30,lev125.80,,119.51,,,,,,,,,,,,,,,
Парфюми ,41975,8054754403282.0,CLN,D&G,D&G K (M) EDP 100ml,,New_,36,€38.75,lev75.79,lev116.80,,110.96,,,,,,,,,,,,,,,
Парфюми ,38878,3760022733146.0,Clean EU,Juliette has a gun,Juliette Has A Gun Lily Fantasy (L) EDP 100ml,,New,9,€39.00,lev76.28,lev108.10,,102.70,,,,,,,,,,,,,,,
Парфюми ,35556,3614227086029.0,Clean EU,Marc Jacobs,Marc Jacobs Perfect (L) EDP 50ml,,,116,€39.00,lev76.28,lev101.00,,99.16,,,,,,,,,,,,,,,
Парфюми ,42166,3614272731943.0,Clean EU,Valentino,Valentino Donna (L) EDP 30ml,,New_,24,€39.00,lev76.28,lev139.20,,132.24,,,,,,,,,,,,,,,
Парфюми ,40295,8011003811410.0,CLN,Versace,Versace Yellow Diamond (L) Set EDT 90ml + BL 100ml,,,273,€39.00,lev76.28,lev135.99,,129.19,,,,,,,,,,,,,,,
Парфюми ,31966,3760260455657.0,Tester,Montale,Montale Diamond Rose (L) EDP 100ml Tester,,,2,€39.30,lev76.86,lev117.00,,111.15,,,,,,,,,,,,,,,
Парфюми ,40039,3614274131406.0,Tester,Azzaro,Azzaro The Most Wanted Intense (M) EDT 100ml Tester,,,60,€39.50,lev77.25,lev118.99,,113.04,,,,,,,,,,,,,,,
Парфюми ,40670,8411061043868.0,Deco,Carolina Herrera,Carolina Herrera 212 Men NYC (M) EDT 100ml,,,188,€39.50,lev77.25,lev122.70,,116.57,,,,,,,,,,,,,,,
Парфюми ,41275,8057971182060.0,Clean EU,D&G,D&G Dolce Rose (L) EDT 75ml,,,12,€39.50,lev77.25,lev89.50,,100.43 ⚠️ Too Low!,,,,,,,,,,,,,,,
Парфюми ,35902,3386460129879.0,CLN,Jimmy Choo,Jimmy Choo I Want Choo Forever (L) EDP 100ml,,New,33,€39.50,lev77.25,lev117.00,,111.15,,,,,,,,,,,,,,,
Парфюми ,34583,3770000002904.0,Clean EU,Juliette has a gun,Juliette Has A Gun Anyway (U) EDP 100ml,,New,35,€39.50,lev77.25,lev103.60,,100.43,,,,,,,,,,,,,,,
Парфюми ,35232,3770000002546.0,Clean EU,Juliette has a gun,Juliette Has A Gun Gentlewoman (L) EDP 100ml,,,42,€39.50,lev77.25,lev100.00,,100.43 ⚠️ Too Low!,,,,,,,,,,,,,,,
Парфюми ,38879,3760022731753.0,Clean EU,Juliette has a gun,Juliette Has A Gun Lipstick Fever (L) EDP 100ml,,New,48,€39.50,lev77.25,lev101.20,,100.43,,,,,,,,,,,,,,,
Парфюми ,34587,3770000002713.0,Clean EU,Juliette has a gun,Juliette Has A Gun Miss Charming (L) EDP 100ml,,New,23,€39.50,lev77.25,lev111.20,,105.64,,,,,,,,,,,,,,,
Парфюми ,34588,3760022730251.0,Clean EU,Juliette has a gun,Juliette Has A Gun Mmmm… (L) EDP 100ml,,New,101,€39.50,lev77.25,lev112.80,,107.16,,,,,,,,,,,,,,,
Парфюми ,34592,3760022730466.0,Clean EU,Juliette has a gun,Juliette Has A Gun Sunny Side Up (L) EDP 100ml,,New,24,€39.50,lev77.25,lev132.47,,125.85,,,,,,,,,,,,,,,
Парфюми ,30183,3760265191840.0,Tester,Mancera,Mancera Purple Flowers (L) EDP 120ml Tester,,,3,€39.50,lev77.25,lev105.00,,100.43,,,,,,,,,,,,,,,
Парфюми ,32294,3760260451642.0,CLN,Montale,Montale Chocolate Greedy (U) EDP 100ml,,,353,€39.50,lev77.25,lev119.90,,113.91,,,,,,,,,,,,,,,
Парфюми ,36287,3423222055615.0,Clean EU,Narciso Rodriguez,Narciso Rodriguez Narciso Cristal (L) EDP 50ml,,,116,€39.50,lev77.25,lev104.99,,100.43,,,,,,,,,,,,,,,
Парфюми ,40662,3349668614462.0,Deco,Paco Rabanne,Paco Rabanne Olympea Flora (L) EDP 50ml,,,13,€39.50,lev77.25,lev104.00,,100.43,,,,,,,,,,,,,,,
Парфюми ,41573,3349668599448.0,CLN,Paco Rabanne,Paco Rabanne Olympea Solar (L) EDP 50ml,,,13,€39.50,lev77.25,lev89.30,,100.43 ⚠️ Too Low!,,,,,,,,,,,,,,,
Candle,39554,690251131136.0,Clean EU,Jo Malone,Jo Malone Oud & Bergamot Home Candle 200g,,,6,€39.50,lev77.25,lev148.00,,139.06,,,,,,,,,,,,,,,
Парфюми ,41256,737052488257.0,Clean EU,Boss,Boss Bottled Night (M) EDT 200ml,,,720,€39.90,lev78.04,lev108.00,,102.60,,,,,,,,,,,,,,,
Парфюми ,40505,3346130422488.0,CLN,Hermes,Hermes Tutti Twilly D Hermes (L) EDP 50ml,,,15,€39.90,lev78.04,lev105.90,,101.45,,,,,,,,,,,,,,,
Парфюми ,42170,3360372013648.0,CLN,Ralph Lauren,Ralph Lauren Safari (M) EDP 125ml,,New,36,€39.90,lev78.04,lev106.00,,101.45,,,,,,,,,,,,,,,
Парфюми ,37742,3349668555062.0,CLN,Paco Rabanne,Paco Rabanne Black XS (L) EDP 80ml,,,60,€40.25,lev78.72,lev99.60,,102.34 ⚠️ Too Low!,,,,,,,,,,,,,,,
Грижа за кожата,30821,768614155805.0,Clean EU,Shiseido,Shiseido Wrinkle Smoothing Contour Serum 30ml,,New,18,€40.50,lev79.21,lev116.56,,110.73,,,,,,,,,,,,,,,
Парфюми ,40262,8011003889419.0,Clean EU,Moschino,Moschino Toy 2 (L) Set EDP 100ml + BL 100ml + EDP 10ml,,,14,€40.90,lev79.99,lev115.00,,109.25,,,,,,,,,,,,,,,
Грижа за кожата,9094,768614191100.0,Clean EU,Shiseido,Shiseido Benefiance Nutriperfect Day Cream SPF15 50ml,,,600,€40.90,lev79.99,lev139.00,,132.05,,,,,,,,,,,,,,,
Aftershave,13001,3348901419161.0,Clean EU,Dior,Dior Homme (M) ASL 100ml,,,34,€41.00,lev80.19,lev119.00,,113.05,,,,,,,,,,,,,,,
Парфюми ,36409,3346130000020.0,Clean EU,Hermes,Hermes Eau De Basilic Pourpre (U) EDC 100ml,,,14,€41.00,lev80.19,lev117.10,,111.25,,,,,,,,,,,,,,,
Парфюми ,34590,3770000002775.0,Clean EU,Juliette has a gun,Juliette Has A Gun Not A Perfume (L) EDP 100ml,,New,360,€41.00,lev80.19,lev110.00,,104.50,,,,,,,,,,,,,,,
Парфюми ,39208,3614273927925.0,CLN,Mugler,Mugler Alien Goddess Supra Florale (L) EDP 60ml,,New_,6,€41.00,lev80.19,lev118.99,,113.04,,,,,,,,,,,,,,,
Парфюми ,40283,8011003889235.0,Clean EU,Versace,Versace Pour Homme (M) Set EDT 100ml + Body Shampoo 150ml + EDT 10ml,,,2,€41.00,lev80.19,lev114.69,,108.96,,,,,,,,,,,,,,,
Парфюми ,41389,8054754400588.0,Clean EU,D&G,D&G Dolce Blue Jasmine (L) Set EDP 75ml + EDP 10ml,,,21,€41.50,lev81.17,lev169.99,,146.10,,,,,,,,,,,,,,,
Парфюми ,38877,3760022733337.0,Clean EU,Juliette has a gun,Juliette Has A Gun Ego Stratis (L) EDP 100ml,,,15,€41.50,lev81.17,lev108.00,,105.52,,,,,,,,,,,,,,,
Парфюми ,34585,3770000002683.0,Clean EU,Juliette has a gun,Juliette Has A Gun Lady Vengeance (U) EDP 100ml,,New,50,€41.50,lev81.17,lev112.50,,106.88,,,,,,,,,,,,,,,
Парфюми ,38881,3770000002331.0,Clean EU,Juliette has a gun,Juliette Has A Gun Magnolia Bliss (L) EDP 100ml,,New,45,€41.50,lev81.17,lev105.80,,105.52,,,,,,,,,,,,,,,
Парфюми ,29440,3760260455770.0,Tester,Montale,Montale Arabians (U) EDP 100ml Tester,,,49,€41.50,lev81.17,lev138.99,,132.04,,,,,,,,,,,,,,,
Парфюми ,40675,3349668617043.0,Deco,Paco Rabanne,Paco Rabanne 1 Million Royal (M) EDP 50ml,,,43,€41.50,lev81.17,lev125.00,,118.75,,,,,,,,,,,,,,,
Парфюми ,40749,3614274085501.0,CLN,Mugler,Mugler Angel Fantasm (L) EDP 50ml,,,24,€41.90,lev81.95,lev145.90,,138.61,,,,,,,,,,,,,,,
Парфюми ,27159,8011003845354.0,CLN,Versace,Versace Eros Flame (M) EDP 100ml,,,87,€41.90,lev81.95,lev104.00,,106.53 ⚠️ Too Low!,,,,,,,,,,,,,,,
Парфюми ,41397,783320421259.0,Deco,Bvlgari,Bvlgari Petits Et Mamans (L) EDT 100ml,,New,360,€42.00,lev82.14,lev108.90,,106.79,,,,,,,,,,,,,,,
Парфюми ,37367,3439600055726.0,Clean EU,Mugler,Mugler A Men (M) EDT 100ml Refillable,,,159,€42.00,lev82.14,lev118.99,,113.04,,,,,,,,,,,,,,,
Парфюми ,41228,8011003891481.0,Tester,Versace,Versace Bright Crystal (L) Parfum 90ml Tester No Cap,,,29,€42.00,lev82.14,lev79.00,,106.79 ⚠️ Too Low!,,,,,,,,,,,,,,,
Парфюми ,27277,8018365070462.0,CLN,Versace,Versace Crystal Noir (L) EDP 90ml,,,360,€42.00,lev82.14,lev107.00,,106.79,,,,,,,,,,,,,,,
Парфюми ,40234,8011003872084.0,Tester,Versace,Versace Eros (M) Parfum 100ml Tester,,,113,€42.00,lev82.14,lev129.00,,122.55,,,,,,,,,,,,,,,
Парфюми ,38475,8057971181353.0,Clean EU,D&G,D&G Light Blue Eau Intense (L) EDP 100ml,,,25,€42.50,lev83.12,lev138.00,,131.10,,,,,,,,,,,,,,,
Парфюми ,40659,3349668614516.0,Deco,Paco Rabanne,Paco Rabanne Invictus Victory Elixir (M) Parfum 50ml,,,4,€42.50,lev83.12,lev132.00,,125.40,,,,,,,,,,,,,,,
Парфюми ,38087,31655513034.0,CLN,Marc Jacobs,Marc Jacobs Daisy (L) EDT 100ml,,,213,€42.90,lev83.90,lev160.00,,151.03,,,,,,,,,,,,,,,
Парфюми ,41659,8011003891504.0,Tester,Versace,Versace Crystal Noir (L) EDP 100ml Tester,,,78,€42.90,lev83.90,lev140.00,,133.00,,,,,,,,,,,,,,,
Парфюми ,31577,8011003995431.0,Clean EU,Versace,Versace Bright Crystal (L) Duo Set 2 x EDT 30ml,,,102,€43.00,lev84.10,lev160.00,,151.38,,,,,,,,,,,,,,,
Парфюми ,40636,8411061088166.0,Deco,Carolina Herrera,Carolina Herrera 212 Vip Men (M) EDT 100ml,,,28,€43.50,lev85.08,lev110.80,,110.60,,,,,,,,,,,,,,,
Парфюми ,37185,3616302780037.0,Clean EU,Marc Jacobs,Marc Jacobs Perfect Intense (L) EDP 50ml,,,66,€43.50,lev85.08,lev107.20,,110.60 ⚠️ Too Low!,,,,,,,,,,,,,,,
Парфюми ,40393,3386460146081.0,Clean EU,Montblanc,Montblanc Explorer Platinum (M) EDP 200ml,,,96,€43.50,lev85.08,lev129.99,,123.49,,,,,,,,,,,,,,,
Парфюми ,38321,3423222080952.0,CLN,Narciso Rodriguez,Narciso Rodriguez All Of Me (L) EDP 50ml,,,14,€43.50,lev85.08,lev129.00,,122.55,,,,,,,,,,,,,,,
Парфюми ,32005,8011003839117.0,Clean EU,Versace,Versace Dylan Blue Pour Femme (L) EDP 100ml,,,4,€43.50,lev85.08,lev103.74,,110.60 ⚠️ Too Low!,,,,,,,,,,,,,,,
Парфюми ,39006,8011003876280.0,CLN,Versace,Versace Dylan Purple Pour Femme (L) EDP 100ml,,,237,€43.50,lev85.08,lev176.00,,153.14,,,,,,,,,,,,,,,
Парфюми ,32565,8011003861224.0,CLN,Versace,Versace Eros (M) EDP 100ml,,,375,€43.90,lev85.86,lev118.00,,112.10,,,,,,,,,,,,,,,
Парфюми ,41638,8011003866502.0,Tester,Atkinsons,Atkinsons 24 Old Bond Street Triple Extract (U) EDC 100ml Tester,,,8,€44.00,lev86.06,lev187.29,,154.90,,,,,,,,,,,,,,,
Парфюми ,42045,3614273521307.0,CLN,Azzaro,Azzaro The Most Wanted Intense (M) EDP 100ml,,,360,€44.00,lev86.06,lev117.00,,111.87,,,,,,,,,,,,,,,
Парфюми ,41648,850049716321.0,CLN,Michael Kors,Michael Kors Pour Femme (L) EDP 100ml,,,158,€44.00,lev86.06,lev119.00,,113.05,,,,,,,,,,,,,,,
Парфюми ,40918,3423222106850.0,CLN,Narciso Rodriguez,Narciso Rodriguez All Of Me (L) EDP 150ml Refill,,,103,€44.00,lev86.06,lev178.00,,154.90,,,,,,,,,,,,,,,
Парфюми ,41227,8011003891474.0,Tester,Versace,Versace Bright Crystal (L) Parfum 90ml Tester,,,60,€44.00,lev86.06,lev99.00,,111.87 ⚠️ Too Low!,,,,,,,,,,,,,,,
Парфюми ,27138,8011003823536.0,CLN,Versace,Versace Eros (L) EDP 100ml,,,48,€44.00,lev86.06,lev125.00,,118.75,,,,,,,,,,,,,,,
Парфюми ,27105,8011003803132.0,CLN,Versace,Versace Man Eau Fraiche (M) EDT 200ml,,New,180,€44.00,lev86.06,lev119.80,,113.81,,,,,,,,,,,,,,,
Парфюми ,31905,3386460118675.0,Clean EU,Montblanc,Montblanc Explorer (M) EDP 200ml,,,13,€44.50,lev87.03,lev127.49,,121.12,,,,,,,,,,,,,,,
Парфюми ,40677,3349668594429.0,Deco,Paco Rabanne,Paco Rabanne Fame (L) EDP 50ml,,,30,€44.50,lev87.03,lev170.00,,156.66,,,,,,,,,,,,,,,
Грижа за кожата,30288,887167485488.0,Clean EU,Estee Lauder,Estee Lauder Advanced Night Repair Synchronized Multi-Recovery Complex Serum 50ml,,,240,€44.50,lev87.03,lev159.20,,151.24,,,,,,,,,,,,,,,
Парфюми ,36894,3274872423008.0,Clean EU,Givenchy,Givenchy Gentleman Intense (M) EDT 100ml,,,36,€44.90,lev87.82,lev154.00,,146.30,,,,,,,,,,,,,,,
Парфюми ,41330,3386460141703.0,CLN,Jimmy Choo,Jimmy Choo I Want Choo Le Parfum (L) Parfum 100ml,,New,180,€44.90,lev87.82,lev118.99,,114.16,,,,,,,,,,,,,,,
Парфюми ,39959,3614274129281.0,CLN,Azzaro,Azzaro The Most Wanted Intense (M) EDT 100ml,,,120,€45.00,lev88.01,lev102.00,,114.41 ⚠️ Too Low!,,,,,,,,,,,,,,,
Парфюми ,39504,3760260458634.0,CLN,Montale,Montale Oudyssee (U) EDP 100ml,,,32,€45.00,lev88.01,lev138.99,,132.04,,,,,,,,,,,,,,,
Парфюми ,41953,3386460143318.0,Tester,Montblanc,Montblanc Extreme Leather (M) EDP 125ml Tester,,,3,€45.00,lev88.01,lev139.00,,132.05,,,,,,,,,,,,,,,
Парфюми ,41954,3386460143325.0,Tester,Montblanc,Montblanc Patchouli Ink (M) EDP 125ml Tester,,,1,€45.00,lev88.01,lev192.00,,158.42,,,,,,,,,,,,,,,
Парфюми ,41952,3386460143332.0,Tester,Montblanc,Montblanc Vetiver Glacier (M) EDP 125ml Tester,,,1,€45.00,lev88.01,lev135.00,,128.25,,,,,,,,,,,,,,,
Парфюми ,32512,3439600056662.0,Tester,Mugler,Mugler Angel (L) EDP 100ml Refillable Tester,,,600,€45.00,lev88.01,lev180.00,,158.42,,,,,,,,,,,,,,,
Парфюми ,32521,3439600040937.0,Tester,Mugler,Mugler Angel Standing Star (L) EDT 100ml Tester,,,23,€45.00,lev88.01,lev150.00,,142.50,,,,,,,,,,,,,,,
Парфюми ,41936,3614274089349.0,CLN,Prada,Prada Luna Rossa Ocean (M) Le Parfum 50ml,,,36,€45.00,lev88.01,lev140.00,,133.00,,,,,,,,,,,,,,,
Парфюми ,40335,8033488156091.0,Tester,Xerjoff,Xerjoff Oud Stars Alexandria II (U) Parfum Hair Mist 30ml Tester,,,1,€45.00,lev88.01,lev190.00,,158.42,,,,,,,,,,,,,,,
Парфюми ,34549,8411061972656.0,Deco,Carolina Herrera,Carolina Herrera 212 Heroes Forever Young (M) EDT 90ml,,,110,€45.50,lev88.99,lev135.00,,128.25,,,,,,,,,,,,,,,
Парфюми ,41838,7640233342053.0,Clean EU,Elie Saab,Elie Saab Elixir Love (L) EDP 100ml,,,15,€45.90,lev89.77,lev180.00,,161.59,,,,,,,,,,,,,,,
Парфюми ,40236,8011003866359.0,CLN,Atkinsons,Atkinsons 24 Old Bond Street (U) EDC 100ml,,,5,€46.00,lev89.97,lev274.00,,161.94,,,,,,,,,,,,,,,
Парфюми ,40237,8011003866496.0,CLN,Atkinsons,Atkinsons 24 Old Bond Street Triple Extract (U) EDC 100ml,,,8,€46.00,lev89.97,lev213.72,,161.94,,,,,,,,,,,,,,,
Парфюми ,39939,783320418945.0,Deco,Bvlgari,Bvlgari Pour Homme (M) EDT 50ml,,,21,€46.00,lev89.97,lev130.00,,123.50,,,,,,,,,,,,,,,
Парфюми ,38918,3346132300029.0,Clean EU,Hermes,Hermes Jour D Hermes (L) EDP 50ml,,,51,€46.00,lev89.97,lev250.00,,161.94,,,,,,,,,,,,,,,
Парфюми ,38515,3349668588718.0,CLN,Paco Rabanne,Paco Rabanne Olympea Blossom (L) EDP 80ml,,,15,€46.00,lev89.97,lev165.00,,156.75,,,,,,,,,,,,,,,
Парфюми ,28986,3605520293405.0,Tester,Viktor & Rolf,V&R Flowerbomb (L) EDP 100ml Tester,,,120,€46.00,lev89.97,lev160.00,,152.00,,,,,,,,,,,,,,,
Парфюми ,39746,3760260455770.0,CLN,Montale,Montale Arabians (U) EDP 100ml,,,240,€46.50,lev90.94,lev170.00,,161.50,,,,,,,,,,,,,,,
Парфюми ,5235,3700358123402.0,Clean EU,Serge Lutens,Serge Lutens Nuit De Cellophane (U) EDP 50ml,,,21,€46.50,lev90.94,lev130.00,,123.50,,,,,,,,,,,,,,,
Парфюми ,39928,783320420627.0,Deco,Bvlgari,Bvlgari Omnia Amethyste (L) EDT 50ml,,,102,€47.00,lev91.92,lev130.00,,123.50,,,,,,,,,,,,,,,
Парфюми ,41263,783320422744.0,Deco,Bvlgari,Bvlgari Petits Et Mamans (L) Set EDT 100ml + BL 75ml + Bag,,New,66,€47.00,lev91.92,lev193.70,,165.46,,,,,,,,,,,,,,,
Парфюми ,41180,8411061093818.0,Clean EU,Carolina Herrera,Carolina Herrera 212 Vip Black MTV Limited Edition (M) EDP 100ml,,,51,€47.00,lev91.92,lev170.00,,161.50,,,,,,,,,,,,,,,
Парфюми ,37732,3616303173098.0,CLN,Boss,Boss Men's Bottled (M) EDP 100ml,,,23,€47.50,lev92.90,lev130.00,,123.50,,,,,,,,,,,,,,,
Парфюми ,39938,783320420573.0,Deco,Bvlgari,Bvlgari Omnia Crystalline (L) EDT 50ml,,,240,€47.50,lev92.90,lev130.00,,123.50,,,,,,,,,,,,,,,
Парфюми ,36010,3346130010067.0,Clean EU,Hermes,Hermes L Ambre Des Merveilles (U) EDP 50ml,,,48,€47.50,lev92.90,lev230.00,,167.22,,,,,,,,,,,,,,,
Парфюми ,26640,3760260450065.0,CLN,Montale,Montale Intense Cafe (U) EDP 100ml,,,8,€47.50,lev92.90,lev129.99,,123.49,,,,,,,,,,,,,,,
Парфюми ,21162,3349666007921.0,Deco,Paco Rabanne,Paco Rabanne 1 Million (M) EDT 100ml,,,72,€47.50,lev92.90,lev129.00,,122.55,,,,,,,,,,,,,,,
Парфюми ,27102,8011003801619.0,CLN,Versace,Versace Pour Homme (M) EDT 200ml,,,235,€47.50,lev92.90,lev150.00,,142.50,,,,,,,,,,,,,,,
Парфюми ,39960,3614273638852.0,CLN,Azzaro,Azzaro The Most Wanted Parfum (M) 100ml,,,92,€47.90,lev93.68,lev161.20,,153.14,,,,,,,,,,,,,,,
Парфюми ,30141,3760265193134.0,Tester,Mancera,Mancera Instant Crush (U) EDP 120ml Tester,,,24,€47.90,lev93.68,lev132.00,,125.40,,,,,,,,,,,,,,,
Парфюми ,31812,3760265193738.0,Tester,Mancera,Mancera Juicy Flowers (L) EDP 120ml Tester,,,4,€47.90,lev93.68,lev132.00,,125.40,,,,,,,,,,,,,,,
Парфюми ,34582,3349668604654.0,Clean EU,Paco Rabanne,Paco Rabanne Phantom (M) Set EDT 100ml + EDT 20ml,,,480,€47.90,lev93.68,lev140.00,  - парфюм,133.00,,,,,,,,,,,,,,,
Парфюми ,38617,3349668612635.0,Deco,Paco Rabanne,Paco Rabanne Olympea (L) EDP 80ml,,,29,€48.00,lev93.88,lev138.40,,131.48,,,,,,,,,,,,,,,
Парфюми ,41391,8054754400632.0,Clean EU,D&G,D&G Q (L) Set EDP 100ml + EDP 5ml + EDP 10ml,,,291,€48.50,lev94.86,lev220.00,,170.74,,,,,,,,,,,,,,,
Парфюми ,40653,3349668614653.0,Deco,Paco Rabanne,Paco Rabanne Fame (L) Parfum 50ml,,,16,€48.50,lev94.86,lev148.00,,140.60,,,,,,,,,,,,,,,
Парфюми ,40275,8011003889020.0,Clean EU,Versace,Versace Bright Crystal Absolu (L) Set EDP 90ml + BL 100ml + SG 100ml + EDP 5ml Mini,,,87,€48.50,lev94.86,lev134.99,,128.24,,,,,,,,,,,,,,,
Парфюми ,40276,8011003889082.0,Clean EU,Versace,Versace Dylan Blue Pour Femme (L) Set EDP 100ml + SG 100ml + BL 100ml + EDP Mini,,,16,€48.50,lev94.86,lev134.99,,128.24,,,,,,,,,,,,,,,
Парфюми ,31124,3614272050341.0,Deco,YSL,YSL Y (M) EDP 60ml,,,103,€48.50,lev94.86,lev141.00,,133.95,,,,,,,,,,,,,,,
Парфюми ,28825,3386460103114.0,Tester,Boucheron,Boucheron Patchouli D Angkor (U) EDP 125ml Tester,,,4,€49.00,lev95.83,lev129.00,,124.58,,,,,,,,,,,,,,,
Парфюми ,37738,3614229395709.0,CLN,Chloe,Chloe Nomade Naturelle (L) EDP 75ml,,,48,€49.00,lev95.83,lev155.44,,147.67,,,,,,,,,,,,,,,
Парфюми ,41829,3346130493594.0,CLN,Hermes,Hermes Eau D Orange Verte (U) EDC 100ml,,,24,€49.00,lev95.83,lev116.70,,124.58 ⚠️ Too Low!,,,,,,,,,,,,,,,
Парфюми ,38518,3760265194391.0,Tester,Mancera,Mancera Tonka Cola (U) EDP 120ml Tester,,,12,€49.00,lev95.83,lev130.00,,124.58,,,,,,,,,,,,,,,
Парфюми ,37806,3614273772495.0,Tester,Mugler,Mugler Angel Elixir (L) EDP 100ml Tester,,,60,€49.00,lev95.83,lev139.99,,132.99,,,,,,,,,,,,,,,
Парфюми ,40746,3614274085518.0,Tester,Mugler,Mugler Angel Fantasm (L) EDP 100ml Tester,,,120,€49.00,lev95.83,lev169.90,,161.41,,,,,,,,,,,,,,,
Парфюми ,40654,3349668614707.0,Tester,Paco Rabanne,Paco Rabanne Fame (L) Parfum 80ml Tester,,,24,€49.00,lev95.83,lev86.00,,124.58 ⚠️ Too Low!,,,,,,,,,,,,,,,
Парфюми ,38820,8435137759781.0,Deco,Prada,Prada Luna Rossa Carbon (M) EDT 100ml,,,144,€49.00,lev95.83,lev141.00,,133.95,,,,,,,,,,,,,,,
Парфюми ,41425,3614273556620.0,Deco,Prada,Prada Luna Rossa Ocean (M) EDT 100ml,,,16,€49.00,lev95.83,lev144.99,,137.74,,,,,,,,,,,,,,,
Парфюми ,41428,3614273898461.0,Deco,YSL,YSL Y Intense (M) EDP 60ml,,,119,€49.00,lev95.83,lev139.99,,132.99,,,,,,,,,,,,,,,
Парфюми ,39937,783320421327.0,Deco,Bvlgari,Bvlgari Pour Homme (M) EDP 50ml,,,16,€49.50,lev96.81,lev165.00,,156.75,,,,,,,,,,,,,,,
Парфюми ,41393,8054754400748.0,Clean EU,D&G,D&G The One (L) Set EDP 75ml + BL 50ml + EDP 10ml,,,89,€49.50,lev96.81,lev220.00,,174.26,,,,,,,,,,,,,,,
Парфюми ,35496,3760265192076.0,CLN,Mancera,Mancera Hindu Kush (U) EDP 120ml,,,2,€49.50,lev96.81,lev129.99,,125.86,,,,,,,,,,,,,,,
Парфюми ,31215,3349668582297.0,Deco,Paco Rabanne,Paco Rabanne Phantom (M) EDT 100ml,,,72,€49.90,lev97.59,lev139.99,,132.99,,,,,,,,,,,,,,,
Парфюми ,40036,3614272732087.0,Deco,Valentino,Valentino Donna (L) EDP 50ml,,,1,€50.00,lev97.79,lev144.00,,136.80,,,,,,,,,,,,,,,
Парфюми ,38391,3614273478755.0,Deco,Prada,Prada Luna Rossa (M) EDT 100ml,,,761,€50.50,lev98.77,lev141.00,,133.95,,,,,,,,,,,,,,,
Грижа за кожата,23686,729238103214.0,CLN,Shiseido,Shiseido Bio-Performance Advanced Super Revitalizing Cream 75ml,,,480,€50.50,lev98.77,lev176.00,,167.20,,,,,,,,,,,,,,,
Парфюми ,26327,3607346232385.0,CLN,Chloe,Chloe (L) EDP 75ml,,,60,€51.00,lev99.75,lev130.00,,129.67,,,,,,,,,,,,,,,
Парфюми ,41824,3616303459673.0,CLN,Chloe,Chloe Nomade Jasmin Naturelle Intense (L) EDP 75ml,,,24,€51.00,lev99.75,lev190.00,,179.54,,,,,,,,,,,,,,,
Парфюми ,41825,3616302038138.0,CLN,Chloe,Chloe Rose Naturelle Intense (L) EDP 100ml,,,24,€51.00,lev99.75,lev239.00,,179.54,,,,,,,,,,,,,,,
Парфюми ,41437,690251087969.0,Clean EU,Jo Malone,Jo Malone Blackberry & Bay Cologne 50ml,,,28,€51.00,lev99.75,lev161.39,,153.32,,,,,,,,,,,,,,,
Парфюми ,39542,690251084876.0,Clean EU,Jo Malone,Jo Malone English Pear & Freesia Cologne 50ml,,,207,€51.00,lev99.75,lev180.00,,171.00,,,,,,,,,,,,,,,
Парфюми ,39543,690251084906.0,Clean EU,Jo Malone,Jo Malone Lime Basil & Mandarin Cologne 50ml,,,87,€51.00,lev99.75,lev153.40,,145.73,,,,,,,,,,,,,,,
Парфюми ,39545,690251084920.0,Clean EU,Jo Malone,Jo Malone Pomegranate Noir Cologne 50ml,,,75,€51.00,lev99.75,lev148.50,,141.08,,,,,,,,,,,,,,,
Парфюми ,39403,690251084890.0,Clean EU,Jo Malone,Jo Malone Wild Bluebell Cologne 50ml,,,84,€51.00,lev99.75,lev180.00,,171.00,,,,,,,,,,,,,,,
Парфюми ,37582,690251084883.0,Clean EU,Jo Malone,Jo Malone Wood Sage & Sea Salt Cologne 50ml,,,61,€51.00,lev99.75,lev180.00,,171.00,,,,,,,,,,,,,,,
Парфюми ,40720,3770014898272.0,Clean EU,Maison Crivelli,Maison Crivelli Osmanthe Kodoshan (U) EDP 30ml,,,1,€51.00,lev99.75,lev180.00,,171.00,,,,,,,,,,,,,,,
Парфюми ,40045,3614273949477.0,Tester,Maison Margiela,Maison Margiela Replica From The Garden (U) EDT 100ml Tester,,,12,€51.00,lev99.75,lev160.00,,152.00,,,,,,,,,,,,,,,
Парфюми ,42161,3423222108755.0,Clean EU,Narciso Rodriguez,Narciso Rodriguez All Of Me (L) SET EDP 90ml + 10ml,,New_,12,€51.00,lev99.75,lev215.00,  - парфюм,179.54,,,,,,,,,,,,,,,
Парфюми ,38392,3614273544962.0,Deco,Prada,Prada Luna Rossa Sport (M) EDT 100ml,,,320,€51.00,lev99.75,lev144.00,,136.80,,,,,,,,,,,,,,,
Парфюми ,41969,3473311941015.0,CLN,Sisley,Sisley L Eau Rivee d Ikar (M) EDT 100ml,,,6,€51.00,lev99.75,lev190.00,,179.54,,,,,,,,,,,,,,,
Козметика – За мъже,40681,768614215493.0,Clean EU,Shiseido,Shiseido Men Skin Empowering Cream 50ml,,New,180,€51.00,lev99.75,lev218.12,,179.54,,,,,,,,,,,,,,,
Грижа за кожата,40766,768614209973.0,CLN,Shiseido,Shiseido Vital Perfection Uplifting And Firming Advanced Cream 50ml,,,88,€51.00,lev99.75,lev238.00,,179.54,,,,,,,,,,,,,,,
Парфюми ,35502,3760265193585.0,CLN,Mancera,Mancera Saharian Wind (U) EDP 120ml,,,42,€51.50,lev100.72,lev230.00,,181.30,,,,,,,,,,,,,,,
Парфюми ,41427,3614273764223.0,Deco,Mugler,Mugler Alien (L) EDP 100ml Refill,,,195,€51.50,lev100.72,lev155.99,,148.19,,,,,,,,,,,,,,,
Парфюми ,40052,3614274073140.0,Tester,Mugler,Mugler Alien Hypersense (L) EDP 90ml Tester,,,60,€51.50,lev100.72,lev169.99,,161.49,,,,,,,,,,,,,,,
Парфюми ,15481,3473311985507.0,Clean EU,Sisley,Sisley Paris Izia (L) EDP 50ml,,,70,€51.50,lev100.72,lev230.00,,181.30,,,,,,,,,,,,,,,
Парфюми ,35839,8011003872077.0,CLN,Versace,Versace Eros (M) Parfum 100ml,,,38,€51.50,lev100.72,lev118.00,,130.94 ⚠️ Too Low!,,,,,,,,,,,,,,,
Парфюми ,12127,3348900012189.0,Clean EU,Dior,Dior Fahrenheit (M) EDT 50ml,,,178,€51.90,lev101.51,lev133.00,,131.96,,,,,,,,,,,,,,,
Парфюми ,37851,3348901500821.0,Deco,Dior,Dior Miss Dior Rose N Roses (L) EDT 50ml,,,28,€51.90,lev101.51,lev152.20,,144.59,,,,,,,,,,,,,,,
Парфюми ,32003,3346130010647.0,Clean EU,Hermes,Hermes Terre D Hermes (M) Set EDT 2 x 50ml,,,600,€51.90,lev101.51,lev186.99,,177.64,,,,,,,,,,,,,,,
Парфюми ,39498,3760265192007.0,CLN,Mancera,Mancera Musky Garden (U) EDP 120ml,,,40,€51.90,lev101.51,lev137.99,,131.96,,,,,,,,,,,,,,,
Парфюми ,40038,3614273672474.0,Deco,Valentino,Valentino Donna Born In Roma Coral Fantasy (L) EDP 50ml,,,360,€51.90,lev101.51,lev187.00,,177.65,,,,,,,,,,,,,,,
Парфюми ,40710,3770010279228.0,Clean EU,Maison Crivelli,Maison Crivelli Absinthe Boreale (U) EDP 30ml,,,10,€52.00,lev101.70,lev177.00,,168.15,https://tse1.mm.bing.net/th?id=OIP.pkaw6AE5AZjIZDme4A7GBQHaIb&w=474&h=474&c=7,https://tse3.mm.bing.net/th?id=OIP.GgvFhXbXO2y9e7T4XpYonQHaKX&w=474&h=474&c=7,https://tse1.mm.bing.net/th?id=OIP.XRHTpjDeBgGvF2CYBt1qDgHaHa&w=474&h=474&c=7,https://tse3.mm.bing.net/th?id=OIP.XiKTjyL7QqEKQoQrZhcZMgHaHa&w=474&h=474&c=7,,https://youtu.be/L_ngtDvFAXw,,,,,,,,,
