Group,ID,BarCode,Type,Brand,Line,Unnamed: 6,New arrivals,QTY,EUR,BGN,Best Price,Unnamed: 12,Our Price,Image 1,Image 2,Image 3,Image 4,Image 5,Video,1. Captivating Headline or Tagline,2. Sensory Introduction (1–2 sentences),3. Key Features or Ingredients (Bullet Points or Icons),4. How to Use (Optional but useful),5. Emotional or Lifestyle Hook,6. Tech Specs or Product Facts,FAQ,7. SEO Keywords (Behind-the-scenes),✅ Tips for Beauty Product Pages
Парфюми ,27279,8018365071261.0,CLN,Versace,Versace Crystal Noir (L) EDT 50ml,,,85,€29.00,lev56.72,lev86.99,,82.64,https://www.thefragrancecounter.co.uk/user/products/large/crystal_noir_50ml_bottle.jpg,https://static.beautytocare.com/media/catalog/product/cache/global/image/1300x1300/85e4522595efc69f496374d01ef2bf13/v/e/versace-crystal-noir-eau-de-toilette-for-women-50ml.jpg,https://www.versace.com/dw/image/v2/BGWN_PRD/on/demandware.static/-/Sites-ver-master-catalog/default/dw07b15bea/original/90_R07126-R050MLS_RNUL_20_Crystal~Noir~EDT~50~ml-Accessories-Versace-online-store_1_1.jpg?q=85&strip=true&sw=850,https://cdn.shopify.com/s/files/1/2170/5343/products/VERSACE-CRYSTAL-NOIR-Edt_1024x1024.png?v=1656920110,https://perfumescardales.com.ar/wp-content/uploads/2022/07/crystal-noir-edt-4.jpg,https://youtu.be/_M7YZ20gXxk,"„Тъмна чувственост в кристална ръка — невероятна, загадъчна, уверена.“","Една магия от подправки и цветя: пикантен джинджифил и кардамон се срещат с градинския чай и флорален букет, докато базата от сандалово дърво и мускус оставя мистериозен шлейф.","🌶️ Връхни нотки: джинджифил, черен пипер, кардамон — съблазнително топли и пикантни 
perfumescardales.com.ar

fragrancereview.com

🌸 Сърце: gardenia, peony, портокалов цвят (и фрезия/жасмин според версии) — женствен и неочакван 
allure.com


🌳 Бази: сандалово дърво, амбра, мускус, ванилия и cashmeran — дълбок и уютен завършек 
fragrancereview.com


💎 Флакон: тъмно цикламено стъкло с фасетиран кристален капак — стилен акцент за тоалетка

⏳ Трайност: около 6–8 ч., с интензивност и шлейф над средното ниво

🌙 Ароматна група: флорален ориентал – пикантен, дървесен, чувствен","Напръскайте китки, врата и деколте. За по-наситен ефект — добавете малко и в косата или върху шал. Доминирайте вечерта с един елегантен щрих аромат.","За жената-героиня в тъмни тонове — Crystal Noir е изборът, когато се чувстваш загадъчна, силна и неустоима. Подходящ за романтични вечери, парти мигове и моменти, в които искаш да бъдеш център на вниманието.","Спецификация        Подробности
Обем        50 ml EDT
Вид        Eau de Toilette
Трайност        6–8 ч. (зависи от кожа и обстановка)
Производител        Versace (Италия)
Първо лансиране        2004, с обновени версии през 2018 и 2021 

everfumed.com
Семейство        Флорално‑ориентал, пикантно‑дървесно",,"женски аромат сандалово дърво, Versace Crystal Noir EDT 50ml, тъмно-мускусен парфюм, дълготраен вечерен аромат

",
Парфюми ,29367,8018365071476.0,Tester,Versace,Versace Crystal Noir (L) EDT 90ml Tester,,,120,€29.00,lev56.72,lev79.99,,75.99,https://lacasadelperfume.cl/wp-content/uploads/2021/02/Tester-Versace-Crystal-Noir-Edt-90ml-Mujer.jpg,,,,,,,,,,,,,,
Парфюми ,40384,8057971180035.0,Clean EU,D&G,D&G Dolce Shine (L) EDP 50ml,,,12,€29.50,lev57.70,lev62.80,,75.00 ⚠️ Too Low!,,,,,,,,,,,,,,,
Парфюми ,37631,7640233340288.0,Tester,Elie Saab,Elie Saab Girl Of Now Shine (L) EDP 90ml Tester,,,27,€29.50,lev57.70,lev79.99,,75.99,,,,,,,,,,,,,,,
Парфюми ,36380,7640233340059.0,Clean EU,Elie Saab,Elie Saab Le Parfum Essentiel (L) EDP 50ml,,,2,€29.50,lev57.70,lev80.15,,76.14,,,,,,,,,,,,,,,
Парфюми ,36472,7640233340080.0,Clean EU,Elie Saab,Elie Saab Le Parfum Royal (L) EDP 50ml,,,10,€29.50,lev57.70,lev77.99,,75.00,,,,,,,,,,,,,,,
Парфюми ,36481,7640365140633.0,Clean EU,Philipp Plein,Philipp Plein Fatale (L) EDP 90ml,,,40,€29.50,lev57.70,lev79.90,,75.91,,,,,,,,,,,,,,,
Парфюми ,39909,7640365140930.0,Clean EU,Philipp Plein,Philipp Plein Fatale Rose (L) EDP 90ml,,,33,€29.50,lev57.70,lev79.99,,75.99,,,,,,,,,,,,,,,
Парфюми ,35841,8011003818174.0,CLN,Versace,Versace Bright Crystal Absolu (L) EDP 50ml,,,47,€29.50,lev57.70,lev79.60,,75.62,,,,,,,,,,,,,,,
Парфюми ,34842,7640233340714.0,Clean EU,Elie Saab,Elie Saab Le Parfum Lumiere (L) EDP 50ml,,,31,€29.90,lev58.48,lev79.00,,76.02,,,,,,,,,,,,,,,
Парфюми ,1369,737052925073.0,Clean EU,Gucci,Gucci Bamboo (L) EDP 50ml,,,360,€29.90,lev58.48,lev82.00,,77.90,,,,,,,,,,,,,,,
Парфюми ,30646,3386460113588.0,Clean EU,Montblanc,Montblanc Signature (L) EDP 90ml,,,300,€29.90,lev58.48,lev89.90,,85.41,,,,,,,,,,,,,,,
Парфюми ,29330,8011003818129.0,Tester,Versace,Versace Bright Crystal Absolu (L) EDP 90ml Tester,,,30,€29.90,lev58.48,lev82.99,,78.84,,,,,,,,,,,,,,,
Парфюми ,42164,3423222048358.0,Clean EU,Zadig & Voltaire,Zadig & Voltaire This Is Him! Vibes of Freedom (M) EDT 100ml,,New_,12,€29.90,lev58.48,lev99.99,,94.99,,,,,,,,,,,,,,,
Парфюми ,14179,3386460076364.0,Clean EU,Rochas,Rochas Eau De Rochas Homme (M) EDT 200ml,,,67,€29.95,lev58.58,lev84.99,,80.74,,,,,,,,,,,,,,,
Парфюми ,38469,8028713570278.0,Clean EU,Acqua di Parma,ADP Blu Mediterraneo Mandorlo Di Sicilia EDT 30ml,,,11,€30.50,lev59.65,lev161.00,,107.37,,,,,,,,,,,,,,,
Парфюми ,38264,8411061071601.0,Clean EU,Carolina Herrera,Carolina Herrera Chic (L) EDP 80ml,,,3,€30.50,lev59.65,lev78.80,,77.55,,,,,,,,,,,,,,,
Парфюми ,32254,7640233340189.0,Clean EU,Elie Saab,Elie Saab Girl Of Now (L) EDP 50ml,,,64,€30.50,lev59.65,lev86.99,,82.64,,,,,,,,,,,,,,,
Парфюми ,29781,8011003839148.0,Tester,Versace,Versace Dylan Blue Pour Femme (L) EDP 100ml Tester,,,251,€30.50,lev59.65,lev78.00,,77.55,,,,,,,,,,,,,,,
Парфюми ,36473,7640233340141.0,Tester,Elie Saab,Elie Saab Le Parfum Essentiel (L) EDP 90ml Tester,,,43,€30.90,lev60.43,lev89.00,,84.55,,,,,,,,,,,,,,,
Парфюми ,32249,7640233340028.0,Clean EU,Elie Saab,Elie Saab Le Parfum (L) EDP 50ml,,,72,€31.00,lev60.63,lev81.80,,78.82,,,,,,,,,,,,,,,
Парфюми ,40676,3349668594603.0,Deco,Paco Rabanne,Paco Rabanne Fame (L) EDP 30ml,,,24,€31.00,lev60.63,lev96.00,,91.20,,,,,,,,,,,,,,,
Парфюми ,29336,8011003827350.0,Tester,Versace,Versace Eros (L) EDT 100ml Tester,,,3,€31.00,lev60.63,lev81.99,,78.82,,,,,,,,,,,,,,,
Парфюми ,16031,3605520381096.0,Clean EU,Armani,Armani Emporio Armani Diamonds (M) EDT 75ml,,,345,€31.50,lev61.61,lev76.60,,80.09 ⚠️ Too Low!,,,,,,,,,,,,,,,
Парфюми ,25638,3423470300161.0,CLN,Issey Miyake,Issey Miyake L Eau D Issey (L) EDT 100ml,,New_,120,€31.50,lev61.61,lev78.60,,80.09 ⚠️ Too Low!,,,,,,,,,,,,,,,
Парфюми ,25569,3386460101035.0,CLN,Montblanc,Montblanc Explorer (M) EDP 100ml,,,600,€31.50,lev61.61,lev89.80,,85.31,,,,,,,,,,,,,,,
Парфюми ,36985,8011003876327.0,Tester,Versace,Versace Dylan Purple Pour Femme (L) EDP 100ml Tester,,,229,€31.50,lev61.61,lev82.99,,80.09,,,,,,,,,,,,,,,
Парфюми ,31990,6294015131024.0,Clean EU,Armaf,Armaf Club De Nuit Intense Man (M) EDP 200ml,,,720,€31.90,lev62.39,lev81.00,,81.11 ⚠️ Too Low!,,,,,,,,,,,,,,,
Парфюми ,31651,8411061976296.0,Tester,Carolina Herrera,Carolina Herrera 212 Heroes Forever Young (M) EDT 90ml Tester,,,11,€31.90,lev62.39,lev109.00,,103.55,,,,,,,,,,,,,,,
Парфюми ,39694,3386460144230.0,Clean EU,Montblanc,Montblanc Legend Blue (M) EDP 100ml,,,180,€31.95,lev62.49,lev81.90,,81.23,,,,,,,,,,,,,,,
Парфюми ,32516,3439601204659.0,Tester,Mugler,Mugler Alien Goddess (L) EDP 60ml Tester,,,60,€32.00,lev62.59,lev109.99,,104.49,,,,,,,,,,,,,,,
Парфюми ,32880,8411061954966.0,CLN,Carolina Herrera,Carolina Herrera Chic For Men (M) EDT 100ml,,,42,€32.50,lev63.56,lev84.10,,82.63,,,,,,,,,,,,,,,
Парфюми ,41390,8054754400601.0,Clean EU,D&G,D&G K (M) Set EDP 50ml + EDP 5ml,,,175,€32.50,lev63.56,lev124.80,,114.41,,,,,,,,,,,,,,,
Парфюми ,37047,3386460129909.0,Tester,Jimmy Choo,Jimmy Choo I Want Choo Forever (L) EDP 125ml Tester,,,2,€32.50,lev63.56,lev109.00,,103.55,,,,,,,,,,,,,,,
Парфюми ,40752,3386460142014.0,Clean EU,Jimmy Choo,Jimmy Choo I Want Choo Le Parfum (L) Parfum 60ml,,,480,€32.50,lev63.56,lev109.00,,103.55,,,,,,,,,,,,,,,
Парфюми ,14161,3386460074797.0,Clean EU,Montblanc,Montblanc Legend (M) EDT 200ml,,,62,€32.50,lev63.56,lev91.50,,86.93,,,,,,,,,,,,,,,
Парфюми ,30468,3349668545667.0,Clean EU,Paco Rabanne,Paco Rabanne Pure XS (L) EDP 50ml,,New,180,€32.50,lev63.56,lev81.00,,82.63 ⚠️ Too Low!,,,,,,,,,,,,,,,
Парфюми ,37170,8011003861408.0,Tester,Versace,Versace Eros (M) EDP 100ml Tester,,,30,€32.50,lev63.56,lev98.99,,94.04,,,,,,,,,,,,,,,
Парфюми ,38085,3423222086688.0,Clean EU,Zadig & Voltaire,Zadig & Voltaire This Is Him! Undressed (M) EDT 100ml,,New_,12,€32.50,lev63.56,lev99.99,,94.99,,,,,,,,,,,,,,,
Парфюми ,38314,3423222090708.0,CLN,Issey Miyake,Issey Miyake L Eau D Issey Pivoine (L) EDT 100ml,,,5,€32.90,lev64.35,lev95.00,,90.25,,,,,,,,,,,,,,,
Грижа за кожата,8504,729238191129.0,Clean EU,Shiseido,Shiseido Benefiance Nutriperfect Eye Serum 15ml,,,600,€32.90,lev64.35,lev99.99,,94.99,,,,,,,,,,,,,,,
Парфюми ,41642,8011003891146.0,CLN,Dsquared2,Dsquared2 Icon (L) EDP 100ml,,,109,€33.00,lev64.54,lev89.90,,85.41,,,,,,,,,,,,,,,
Парфюми ,41644,8011003891177.0,CLN,Dsquared2,Dsquared2 Icon (M) EDP 100ml,,,89,€33.00,lev64.54,lev89.90,,85.41,,,,,,,,,,,,,,,
Парфюми ,39014,3760022733320.0,Tester,Juliette has a gun,Juliette Has A Gun Ego Stratis (L) EDP 100ml Tester,,,12,€33.00,lev64.54,lev111.00,,105.45,,,,,,,,,,,,,,,
Парфюми ,41259,3760022733313.0,Clean EU,Juliette has a gun,Juliette Has A Gun Ego Stratis (L) EDP 50ml,,,11,€33.00,lev64.54,lev88.50,,84.08,,,,,,,,,,,,,,,
Парфюми ,35568,3770000002560.0,Tester,Juliette has a gun,Juliette Has A Gun Gentlewoman (L) EDP 100ml Tester,,,5,€33.00,lev64.54,lev99.00,,94.05,,,,,,,,,,,,,,,
Парфюми ,36265,3760022733139.0,Tester,Juliette has a gun,Juliette Has A Gun Lili Fantasy (L) EDP 100ml Tester,,,6,€33.00,lev64.54,lev111.30,,105.74,,,,,,,,,,,,,,,
Парфюми ,39197,3760022733573.0,Tester,Juliette has a gun,Juliette Has A Gun Lust For Sun (U) EDP 100ml Tester,,,40,€33.00,lev64.54,lev80.00,,83.90 ⚠️ Too Low!,,,,,,,,,,,,,,,
Парфюми ,33255,3607349764241.0,Clean EU,Marc Jacobs,Marc Jacobs Daisy Dream (L) EDT 100ml,,,462,€33.00,lev64.54,lev99.10,,94.15,,,,,,,,,,,,,,,
Парфюми ,41422,3439600056914.0,Deco,Mugler,Mugler Alien (L) EDP 30ml Refillable,,,208,€33.00,lev64.54,lev92.99,,88.34,,,,,,,,,,,,,,,
Парфюми ,39210,3614273927949.0,CLN,Mugler,Mugler Alien Goddess Supra Florale (L) EDP 30ml,,New_,6,€33.00,lev64.54,lev84.99,,83.90,,,,,,,,,,,,,,,
Продукти за тяло,33023,690251038596.0,Clean EU,Jo Malone,Jo Malone Lime Basil & Mandarin Body And Hand Lotion 250ml,,,14,€33.00,lev64.54,lev133.00,,116.17,,,,,,,,,,,,,,,
Парфюми ,34600,3770000002782.0,Clean EU,Juliette has a gun,Juliette Has A Gun Not A Perfume (L) EDP 50ml,,New,240,€33.25,lev65.03,lev83.20,,84.54 ⚠️ Too Low!,,,,,,,,,,,,,,,
Парфюми ,36310,3274872424999.0,Clean EU,Givenchy,Givenchy Gentleman (M) EDT 60ml,,,11,€33.50,lev65.52,lev89.00,,85.18,,,,,,,,,,,,,,,
Aftershave,29789,8435415012720.0,Deco,JPG,JPG Le Male (M) ASL 125ml,,,36,€33.50,lev65.52,lev107.09,,101.74,,,,,,,,,,,,,,,
Парфюми ,29457,3760260451642.0,Tester,Montale,Montale Chocolate Greedy (U) EDP 100ml Tester,,,16,€33.50,lev65.52,lev109.00,,103.55,,,,,,,,,,,,,,,
Парфюми ,42050,3605972910240.0,CLN,Ralph Lauren,Ralph Lauren Polo 67 (M) EDT 125ml,,,18,€33.50,lev65.52,lev99.00,,94.05,,,,,,,,,,,,,,,
Парфюми ,37778,3605521515346.0,CLN,Viktor & Rolf,V&R Spicebomb (M) EDT 90ml,,,120,€33.50,lev65.52,lev174.30,,117.93,,,,,,,,,,,,,,,
Парфюми ,29331,8011003823581.0,Tester,Versace,Versace Eros (L) EDP Tester 100ml,,,120,€33.50,lev65.52,lev96.00,,91.20,,,,,,,,,,,,,,,
Парфюми ,27176,8011003995967.0,CLN,Versace,Versace Pour Homme (M) EDT 100ml,,,360,€33.50,lev65.52,lev94.90,,90.16,,,,,,,,,,,,,,,
Парфюми ,42162,3423222048310.0,Clean EU,Zadig & Voltaire,Zadig & Voltaire This is Her! Vibes of Freedom (L) EDP 100ml,,New_,12,€33.50,lev65.52,lev115.80,,110.01,,,,,,,,,,,,,,,
Парфюми ,36219,3423474896257.0,Clean EU,Zadig & Voltaire,Zadig & Voltaire This Is Him (M) EDT 100ml,,New_,24,€33.50,lev65.52,lev92.10,,87.50,,,,,,,,,,,,,,,
Грижа за кожата,41927,4020829103108.0,Clean EU,Dr. Hauschka,Dr. Hauschka Regenerating Serum 30ml,,,141,€33.70,lev65.91,lev85.90,,85.68,,,,,,,,,,,,,,,
Парфюми ,4186,3605521879905.0,Clean EU,Viktor & Rolf,V&R Bonbon (L) EDP 50ml,,,146,€33.90,lev66.30,lev87.80,,86.19,,,,,,,,,,,,,,,
Парфюми ,34840,7640233340110.0,Clean EU,Elie Saab,Elie Saab Le Parfum In White (L) EDP 50ml,,,27,€34.00,lev66.50,lev74.70,,86.45 ⚠️ Too Low!,,,,,,,,,,,,,,,
Парфюми ,40674,8435415059084.0,Deco,JPG,JPG Scandal (L) EDP 30ml,,,16,€34.00,lev66.50,lev97.90,,93.01,,,,,,,,,,,,,,,
Парфюми ,34598,3760022730268.0,Clean EU,Juliette has a gun,Juliette Has A Gun Mmmm… (L) EDP 50ml,,New,36,€34.00,lev66.50,lev81.30,,86.45 ⚠️ Too Low!,,,,,,,,,,,,,,,
Парфюми ,41769,7640233342077.0,Tester,Elie Saab,Elie Saab Elixir Love (L) EDP 100ml Tester,,,7,€34.50,lev67.48,lev89.00,,87.72,,,,,,,,,,,,,,,
Парфюми ,33263,7640233341094.0,Tester,Elie Saab,Elie Saab Girl Of Now Lovely (L) EDP 90ml Tester,,,30,€34.50,lev67.48,lev63.99,,87.72 ⚠️ Too Low!,,,,,,,,,,,,,,,
Парфюми ,41768,7640233342480.0,Tester,Elie Saab,Elie Saab Girl Of Now Rose Petal (L) EDP 90ml Tester,,,26,€34.50,lev67.48,lev99.00,,94.05,,,,,,,,,,,,,,,
Парфюми ,40601,7640233341735.0,Tester,Elie Saab,Elie Saab Le Parfum Bridal (L) EDP 90ml Tester,,,45,€34.50,lev67.48,lev87.99,,87.72,,,,,,,,,,,,,,,
Парфюми ,40663,3349668599424.0,Deco,Paco Rabanne,Paco Rabanne Olympea Solar (L) EDP 30ml,,,12,€34.50,lev67.48,lev99.90,,94.91,,,,,,,,,,,,,,,
Парфюми ,37261,8011003845514.0,Tester,Versace,Versace Eros Flame (M) EDP 100ml Tester,,,210,€34.50,lev67.48,lev89.99,,87.72,,,,,,,,,,,,,,,
Парфюми ,37735,3423222086640.0,Clean EU,Zadig & Voltaire,Zadig & Voltaire This is Her! Undressed (L) EDP 100ml,,New_,12,€34.50,lev67.48,lev107.00,,101.65,,,,,,,,,,,,,,,
Грижа за кожата,30815,768614149545.0,CLN,Shiseido,Shiseido Benefiance Wrinkle Smoothing Cream Enriched 50ml,,,270,€34.50,lev67.48,lev105.10,,99.85,,,,,,,,,,,,,,,
Парфюми ,32106,3346130009610.0,Deco,Hermes,Hermes Terre D Hermes (M) EDT 50ml,,,120,€34.90,lev68.26,lev107.85,,102.46,,,,,,,,,,,,,,,
Парфюми ,31845,3386460119283.0,Tester,Jimmy Choo,Jimmy Choo I Want Choo (L) EDP 125ml Tester,,,24,€34.90,lev68.26,lev105.00,,99.75,,,,,,,,,,,,,,,
Продукти за тяло,39404,690251040377.0,Clean EU,Jo Malone,Jo Malone English Pear & Freesia Body And Hand Lotion 250ml,,,40,€34.90,lev68.26,lev133.00,,122.86,,,,,,,,,,,,,,,
Парфюми ,39889,3614274222142.0,Clean EU,Armani,Armani Emporio Armani He (M) EDT 100ml,,,480,€34.95,lev68.36,lev99.80,,94.81,,,,,,,,,,,,,,,
Парфюми ,39167,8011003811212.0,Tester,Versace,Versace Oud Noir Pour Homme (M) EDP Tester 100ml,,,79,€34.95,lev68.36,lev89.99,,88.86,,,,,,,,,,,,,,,
Парфюми ,38390,3614273903172.0,CLN,Azzaro,Azzaro Wanted (M) EDP 100ml,,,480,€35.00,lev68.45,lev102.00,,96.90,,,,,,,,,,,,,,,
Парфюми ,27965,3760260452595.0,Tester,Montale,Montale Jasmin Full (U) EDP 100ml Tester,,,10,€35.00,lev68.45,lev97.00,,92.15,,,,,,,,,,,,,,,
Грижа за кожата,33211,768614163794.0,Clean EU,Shiseido,Shiseido Vital Perfection Uplifting And Firming Eye Cream 15ml,,,480,€35.00,lev68.45,lev104.59,,99.36,,,,,,,,,,,,,,,
Парфюми ,33184,737052339207.0,Clean EU,Gucci,Gucci Guilty (M) EDT 50ml,,,83,€35.50,lev69.43,lev107.00,,101.65,,,,,,,,,,,,,,,
Парфюми ,37372,3274872427204.0,CLN,Kenzo,Kenzo Flower By Kenzo (L) EDP 100ml Refillable,,,600,€35.50,lev69.43,lev105.50,,100.23,,,,,,,,,,,,,,,
Парфюми ,42160,3423222108267.0,CLN,Narciso Rodriguez,Narciso Rodriguez All Of Me Intense (L) EDP 50ml,,New_,12,€35.50,lev69.43,lev158.95,,124.98,,,,,,,,,,,,,,,
Парфюми ,27143,8011003825745.0,CLN,Versace,Versace Dylan Blue Pour Homme (M) EDT 100ml,,,480,€35.50,lev69.43,lev91.90,,90.26,,,,,,,,,,,,,,,
Парфюми ,27108,8011003804566.0,CLN,Versace,Versace Yellow Diamond (L) EDT 90ml,,,329,€35.75,lev69.92,lev93.30,,90.90,,,,,,,,,,,,,,,
Грижа за кожата,9090,768614149538.0,Clean EU,Shiseido,Shiseido Benefiance Wrinkle Smoothing Cream 50ml,,New,120,€35.90,lev70.21,lev125.40,,119.13,,,,,,,,,,,,,,,
Парфюми ,39098,3351500016617.0,CLN,Azzaro,Azzaro Wanted (M) EDT 100ml,,,360,€36.00,lev70.41,lev87.30,,91.53 ⚠️ Too Low!,,,,,,,,,,,,,,,
Парфюми ,41382,20714711740.0,Clean EU,Clinique,Clinique Aromatics In White (L) EDP 100ml,,,360,€36.00,lev70.41,lev103.00,,97.85,,,,,,,,,,,,,,,
Парфюми ,41827,8057971183807.0,Clean EU,D&G,D&G Dolce Violet (L) EDT 75ml,,,7,€36.00,lev70.41,lev82.90,,91.53 ⚠️ Too Low!,,,,,,,,,,,,,,,
Парфюми ,37807,3614273673372.0,Tester,Mugler,Mugler Alien Goddess Intense (L) EDP 60ml Tester,,,177,€36.00,lev70.41,lev98.99,,94.04,,,,,,,,,,,,,,,
Грижа за кожата,34945,729238163805.0,Clean EU,Shiseido,Shiseido Vital Perfection Uplifting And Firming Express Eye Mask 2 Patch X 12,,,195,€36.00,lev70.41,lev161.05,,126.74,,,,,,,,,,,,,,,
Парфюми ,34553,8411061994702.0,Deco,Carolina Herrera,Carolina Herrera 212 Heroes Forever Young (L) EDP 50ml,,,57,€36.50,lev71.39,lev109.00,,103.55,,,,,,,,,,,,,,,
Парфюми ,27607,8411061865583.0,CLN,Carolina Herrera,Carolina Herrera 212 Sexy Men (M) EDT 100ml,,,411,€36.50,lev71.39,lev114.80,,109.06,,,,,,,,,,,,,,,
Парфюми ,22814,8411061926093.0,Deco,Carolina Herrera,Carolina Herrera Bad Boy (M) EDT 50ml,,,43,€36.50,lev71.39,lev98.00,,93.10,,,,,,,,,,,,,,,
Парфюми ,40385,8057971180042.0,Clean EU,D&G,D&G Dolce Shine (L) EDP 75ml,,,90,€36.50,lev71.39,lev89.90,,92.80 ⚠️ Too Low!,,,,,,,,,,,,,,,
Парфюми ,34847,7640233340066.0,Clean EU,Elie Saab,Elie Saab Le Parfum Essentiel (L) EDP 90ml,,,39,€36.50,lev71.39,lev79.99,,92.80 ⚠️ Too Low!,,,,,,,,,,,,,,,
Парфюми ,34843,7640233340721.0,Clean EU,Elie Saab,Elie Saab Le Parfum Lumiere (L) EDP 90ml,,,8,€36.50,lev71.39,lev100.50,,95.48,,,,,,,,,,,,,,,
Парфюми ,37573,690251026098.0,Clean EU,Jo Malone,Jo Malone Blackberry & Bay Cologne 30ml,,,184,€36.50,lev71.39,lev112.80,,107.16,,,,,,,,,,,,,,,
Парфюми ,37571,690251019090.0,Clean EU,Jo Malone,Jo Malone English Pear & Freesia Cologne 30ml,,,180,€36.50,lev71.39,lev106.80,,101.46,,,,,,,,,,,,,,,
Парфюми ,39541,690251145607.0,Clean EU,Jo Malone,Jo Malone English Pear & Sweet Pea Cologne 30ml,,,47,€36.50,lev71.39,lev110.20,,104.69,,,,,,,,,,,,,,,
Парфюми ,37578,690251063260.0,Clean EU,Jo Malone,Jo Malone Honeysuckle & Davana Cologne 30ml,,,99,€36.50,lev71.39,lev141.00,,128.50,,,,,,,,,,,,,,,
Парфюми ,37566,690251000036.0,Clean EU,Jo Malone,Jo Malone Lime Basil & Mandarin Cologne 30ml,,,216,€36.50,lev71.39,lev104.70,,99.47,,,,,,,,,,,,,,,
Парфюми ,37576,690251042302.0,Clean EU,Jo Malone,Jo Malone Mimosa & Cardamom Cologne 30ml,,,99,€36.50,lev71.39,lev112.80,,107.16,,,,,,,,,,,,,,,
Парфюми ,37570,690251009008.0,Clean EU,Jo Malone,Jo Malone Nectarine Blossom & Honey Cologne 30ml,,,94,€36.50,lev71.39,lev102.50,,97.38,,,,,,,,,,,,,,,
Парфюми ,37569,690251006564.0,Clean EU,Jo Malone,Jo Malone Orange Blossom Cologne 30ml,,,93,€36.50,lev71.39,lev141.00,,128.50,,,,,,,,,,,,,,,
Парфюми ,37574,690251028405.0,Clean EU,Jo Malone,Jo Malone Peony & Blush Suede Cologne 30ml,,,110,€36.50,lev71.39,lev112.80,,107.16,,,,,,,,,,,,,,,
Парфюми ,37567,690251009435.0,Clean EU,Jo Malone,Jo Malone Pomegranate Noir Cologne 30ml,,,26,€36.50,lev71.39,lev141.00,,128.50,,,,,,,,,,,,,,,
Парфюми ,37579,690251082803.0,Clean EU,Jo Malone,Jo Malone Poppy & Barley Cologne 30ml,,,148,€36.50,lev71.39,lev103.30,,98.14,,,,,,,,,,,,,,,
Парфюми ,37572,690251021741.0,Clean EU,Jo Malone,Jo Malone Wild Bluebell Cologne 30ml,,,172,€36.50,lev71.39,lev101.90,,96.81,,,,,,,,,,,,,,,
Парфюми ,37575,690251033720.0,Clean EU,Jo Malone,Jo Malone Wood Sage & Sea Salt Cologne 30ml,,,360,€36.50,lev71.39,lev97.80,,92.91,,,,,,,,,,,,,,,
Парфюми ,27983,3760260450744.0,Tester,Montale,Montale Aoud Flowers (M) EDP 100ml Tester,,,10,€36.50,lev71.39,lev89.00,,92.80 ⚠️ Too Low!,,,,,,,,,,,,,,,
Парфюми ,22857,8435137759811.0,Deco,Prada,Prada Luna Rossa Carbon (M) EDT 50ml,,,400,€36.50,lev71.39,lev107.00,,101.65,,,,,,,,,,,,,,,
Парфюми ,37447,3386460082112.0,Clean EU,Rochas,Rochas Eau De Rochas (L) EDT 220ml,,,60,€36.50,lev71.39,lev120.80,,114.76,,,,,,,,,,,,,,,
Парфюми ,29347,8011003997831.0,Tester,Versace,Versace Crystal Noir (L) EDP 90ml Tester,,,52,€36.50,lev71.39,lev108.99,,103.54,,,,,,,,,,,,,,,
Парфюми ,41392,8054754400649.0,Clean EU,D&G,D&G Q (L) Set EDP 50ml + EDP 5ml,,,203,€36.90,lev72.17,lev177.00,,129.90,,,,,,,,,,,,,,,
Парфюми ,37634,7640233341070.0,Clean EU,Elie Saab,Elie Saab Girl Of Now Lovely (L) EDP 90ml,,,45,€36.90,lev72.17,lev99.00,,94.05,,,,,,,,,,,,,,,
Парфюми ,35366,7640233340196.0,Clean EU,Elie Saab,Elie Saab Girl Of Now (L) EDP 90ml,,,11,€37.00,lev72.36,lev100.10,,95.10,,,,,,,,,,,,,,,
Парфюми ,36320,7640233340226.0,Clean EU,Elie Saab,Elie Saab Girl Of Now Forever (L) EDP 90ml,,,140,€37.00,lev72.36,lev117.90,,112.01,,,,,,,,,,,,,,,
Парфюми ,31907,3386460119252.0,CLN,Jimmy Choo,Jimmy Choo I Want Choo (L) EDP 100ml,,,180,€37.00,lev72.36,lev109.80,,104.31,,,,,,,,,,,,,,,
Парфюми ,35901,3386460108768.0,Clean EU,Jimmy Choo,Jimmy Choo Man Intense (M) EDT 200ml,,,270,€37.00,lev72.36,lev119.00,,113.05,,,,,,,,,,,,,,,
Парфюми ,29392,8411061778296.0,Tester,Carolina Herrera,Carolina Herrera 212 Vip Rose (L) EDP 80ml Tester,,,6,€37.50,lev73.34,lev112.20,,106.59,,,,,,,,,,,,,,,
Парфюми ,39910,7640233341711.0,Clean EU,Elie Saab,Elie Saab Le Parfum Bridal (L) EDP 90ml,,,2,€37.50,lev73.34,lev113.99,,108.29,,,,,,,,,,,,,,,
Парфюми ,36317,7640233340097.0,Clean EU,Elie Saab,Elie Saab Le Parfum Royal (L) EDP 90ml,,,48,€37.50,lev73.34,lev119.70,,113.72,,,,,,,,,,,,,,,
Парфюми ,30181,3760265191406.0,Tester,Mancera,Mancera Pink Prestigium (L) EDP 120ml Tester,,,3,€37.50,lev73.34,lev135.00,,128.25,,,,,,,,,,,,,,,
Парфюми ,37291,3439600040920.0,Clean EU,Mugler,Mugler Angel (L) EDT 50ml,,,42,€37.50,lev73.34,lev109.00,,103.55,,,,,,,,,,,,,,,
Парфюми ,40027,3614273478748.0,Deco,Prada,Prada Luna Rossa (M) EDT 50ml,,,54,€37.50,lev73.34,lev101.30,,96.24,,,,,,,,,,,,,,,
Парфюми ,39104,3360377002968.0,CLN,Ralph Lauren,Ralph Lauren Romance (L) EDP 100ml,,,120,€37.50,lev73.34,lev97.60,,95.35,,,,,,,,,,,,,,,
Парфюми ,27115,8011003809219.0,CLN,Versace,Versace Eros (M) EDT 100ml,,,360,€37.50,lev73.34,lev99.00,,95.35,,,,,,,,,,,,,,,
Candle,39552,690251131143.0,Clean EU,Jo Malone,Jo Malone Myrrh & Tonka Home Candle 200g,,,23,€37.50,lev73.34,lev135.00,,128.25,,,,,,,,,,,,,,,
Грижа за кожата,34815,768614166597.0,Clean EU,Shiseido,Shiseido Benefiance Overnight Wrinkle Resisting Cream 50ml,,,480,€37.50,lev73.34,lev111.30,,105.74,,,,,,,,,,,,,,,
Грижа за кожата,30816,768614149521.0,Clean EU,Shiseido,Shiseido Benefiance Wrinkle Smoothing Day Emulsion SPF20 75ml,,,240,€37.50,lev73.34,lev103.30,,98.14,,,,,,,,,,,,,,,
Парфюми ,42165,3274872406216.0,CLN,Kenzo,Kenzo Flower By Kenzo Poppy Bouquet Florale (L) EDP 100ml,,New_,12,€37.90,lev74.12,lev108.80,,103.36,,,,,,,,,,,,,,,
Грижа за кожата,9089,768614149514.0,Clean EU,Shiseido,Shiseido Benefiance Wrinkle Smoothing Day Cream SPF25 50ml,,,600,€37.90,lev74.12,lev119.90,,113.91,,,,,,,,,,,,,,,
Парфюми ,41831,8057971180936.0,Tester,D&G,D&G The One (L) EDP 75ml Tester,,,8,€38.00,lev74.32,lev99.99,,96.62,,,,,,,,,,,,,,,
Парфюми ,34838,7640233340257.0,Clean EU,Elie Saab,Elie Saab Girl Of Now Shine (L) EDP 90ml,,,110,€38.00,lev74.32,lev105.00,,99.75,,,,,,,,,,,,,,,
Парфюми ,33309,8055118032124.0,Clean EU,Masque Milano,Masque Milano Love Kills (U) EDP 35ml,,,5,€38.00,lev74.32,lev330.70,,133.78,,,,,,,,,,,,,,,
Парфюми ,41651,850049716369.0,Tester,Michael Kors,Michael Kors Pour Femme (L) EDP 100ml Tester,,,105,€38.00,lev74.32,lev146.80, (не е тестер),133.78,,,,,,,,,,,,,,,
Парфюми ,21229,3349668568093.0,Deco,Paco Rabanne,Paco Rabanne Olympea (L) EDP 50ml,,,9,€38.00,lev74.32,lev111.00,,105.45,,,,,,,,,,,,,,,
