Group,ID,BarCode,Type,Brand,Line,Unnamed: 6,New arrivals,QTY,EUR,BGN,Best Price,Unnamed: 12,Our Price,Image 1,Image 2,Image 3,Image 4,Image 5,Video,1. Captivating Headline or Tagline,2. Sensory Introduction (1–2 sentences),3. Key Features or Ingredients (Bullet Points or Icons),4. How to Use (Optional but useful),5. Emotional or Lifestyle Hook,6. Tech Specs or Product Facts,FAQ,7. SEO Keywords (Behind-the-scenes),✅ Tips for Beauty Product Pages
Козметика,36965,,Deco,Clarins,Clarins White Plus Pure Translucency Targeted Spot Brightener 7ml,,,65,€5.00,lev9.78,,,,https://tse1.mm.bing.net/th?id=OIP.7uJlAM14Bn6K8osISzKuEQHaHa&r=0&w=474&h=474&c=7,https://tse3.mm.bing.net/th?id=OIP.ICrcLyd07k3E101gqGh2XQHaHa&r=0&w=474&h=474&c=7,https://tse3.mm.bing.net/th?id=OIP.1By5eNVdsSEtdyfg45yt0AHaHa&r=0&w=474&h=474&c=7,https://tse3.mm.bing.net/th?id=OIP.eW3OBdVTg-DNAsqSlJWRpgHaHa&r=0&w=474&h=474&c=7, ,https://youtu.be/VD9cRQACrm8,,,,,,,,,
Грим,7907,602004057969.0,Clean EU,Benefit,Benefit Roller Lash Mascara Mini 4g,,,130,€8.00,lev15.65,lev27.10,,25.75,,,,,,,,,,,,,,,https://www.youtube.com/watch?v=aUG7zQ2PYAY
Парфюми ,37813,8018365500266.0,Tester,Versace,Versace Red Jeans (L) EDT 75ml Tester,,,240,€8.50,lev16.62,lev28.99,,27.54,,,,,,,,,,,,,,,
Грим,7901,602004057280.0,Clean EU,Benefit,Benefit The Porefessional Pore Primer Mini 7.5ml,,,415,€8.50,lev16.62,lev27.20,,25.84,,,,,,,,,,,,,,,
 Грижа за косата,34629,5060616950002.0,Clean EU,We are Paradox,We Are Paradox Volume Shampoo 250ml,,,9,€8.75,lev17.11,lev44.20,,30.80,,,,,,,,,,,,,,,
Парфюми ,38847,88300104680.0,Clean EU,CK,CK Be (U) EDT 50ml,,,682,€9.00,lev17.60,lev32.50,,30.88,,,,,,,,,,,,,,,
Грижа за кожата,25403,3380810106787.0,CLN,Clarins,Clarins White Plus Pure Translucency Brightening Revive Night Mask Gel 50ml,,,152,€9.00,lev17.60,lev34.99,,31.68,,,,,,,,,,,,,,,
Парфюми ,37270,3614273667425.0,Tester,Azzaro,Azzaro Sport (M) EDT 100ml Tester,,,70,€9.25,lev18.09,lev33.99,,32.29,,,,,,,,,,,,,,,
Парфюми ,41926,8057971188529.0,Sample,D&G,D&G L'Imperatrice (L) Set EDP 10ml + EDP 5ml,,,240,€9.50,lev18.58,lev26.99,,25.64,,,,,,,,,,,,,,,
Парфюми ,14090,3386460059138.0,Clean EU,Karl Lagerfeld,Karl Lagerfeld (L) EDP 25ml,,,11,€9.75,lev19.07,lev33.00,,31.35,,,,,,,,,,,,,,,
Парфюми ,14264,3386460089012.0,Clean EU,S.T. Dupont,Dupont Be Exceptional (M) EDT 50ml,,,231,€9.90,lev19.36,lev33.99,,32.29,,,,,,,,,,,,,,,
Парфюми ,13989,3386460010412.0,Clean EU,Lanvin,Lanvin Jeanne (L) EDP 30ml,,,56,€9.90,lev19.36,lev28.30,,26.89,,,,,,,,,,,,,,,
Грижа за кожата,33163,192333066928.0,Clean EU,Clinique,Clinique Moisture Surge 100H Auto-Replenishing Hydrator 30ml,,,480,€9.90,lev19.36,lev29.04,,27.59,,,,,,,,,,,,,,,
Парфюми ,38099,4011700449019.0,Clean EU,Tabac,Tabac Man (M) EDT 50ml,,,122,€10.25,lev20.05,lev42.40,,36.08,,,,,,,,,,,,,,,
Парфюми ,35371,6294015102239.0,Clean EU,Armaf,Armaf Le Parfait Homme (M) EDT 100ml,,,24,€10.50,lev20.54,lev34.99,,33.24,,,,,,,,,,,,,,,
Парфюми ,36356,88300606504.0,Clean EU,CK,CK Obsession For Men (M) EDT 75ml,,,720,€10.50,lev20.54,lev30.80,,29.26,,,,,,,,,,,,,,,
Парфюми ,7821,88300196920.0,Clean EU,CK,CK IN2U (M) EDT 50ml,,,1,€10.90,lev21.32,lev50.00,,38.37,,,,,,,,,,,,,,,
Козметика,39868,192333150283.0,Clean EU,Clinique,Clinique Take The Day Off Charcoal Cleansing Balm 30ml,,,15,€10.95,lev21.42,lev23.50,,27.84 ⚠️ Too Low!,,,,,,,,,,,,,,,
Парфюми ,39416,3760022730299.0,Clean EU,Juliette has a gun,Juliette Has A Gun Mmmm… (L) EDP 7.5 ml,,,12,€11.00,lev21.51,lev22.00,,27.97 ⚠️ Too Low!,,,,,,,,,,,,,,,
Парфюми ,41955,3386460160810.0,Tester,Karl Lagerfeld,Karl Lagerfeld Jeans Urban Blue (M) EDT 60ml Tester,,,10,€11.00,lev21.51,lev18.90,,27.97 ⚠️ Too Low!,,,,,,,,,,,,,,,
Парфюми ,41956,3386460160803.0,Tester,Karl Lagerfeld,Karl Lagerfeld Jeans Urban Pink (L) EDP 60ml Tester,,,10,€11.00,lev21.51,lev18.90,,27.97 ⚠️ Too Low!,,,,,,,,,,,,,,,
Парфюми ,14089,3386460059121.0,Clean EU,Karl Lagerfeld,Karl Lagerfeld (L) EDP 45ml,,New_,48,€11.25,lev22.00,lev28.10,,28.60 ⚠️ Too Low!,,,,,,,,,,,,,,,
Парфюми ,35894,3616302015580.0,Clean EU,CK,CK Free Men (M) EDT 100ml,,,720,€11.50,lev22.49,lev31.10,,29.55,,,,,,,,,,,,,,,
Грижа за кожата,6639,20714227685.0,Clean EU,Clinique,Clinique Liquid Facial Soap - Combination Oily To Oily 200ml,,,480,€11.50,lev22.49,lev52.99,,40.49,,,,,,,,,,,,,,,
Козметика – Слънцезащита,23732,729238125551.0,CLN,Shiseido,Shiseido Sun After Emulsion 150ml,,,140,€11.50,lev22.49,lev54.00,,40.49,,,,,,,,,,,,,,,
Парфюми ,14301,3386460101301.0,Clean EU,S.T. Dupont,Dupont Be Exceptional Gold (M) EDP 50ml,,,132,€11.90,lev23.27,lev39.28,,37.32,,,,,,,,,,,,,,,
Парфюми ,40756,3386460133876.0,Clean EU,Karl Lagerfeld,Karl Lagerfeld Bois De Cypres (M) EDT 50ml,,,25,€11.90,lev23.27,lev29.70,,30.26 ⚠️ Too Low!,,,,,,,,,,,,,,,
Парфюми ,14255,3386460087285.0,Clean EU,Karl Lagerfeld,Karl Lagerfeld Bois De Vetiver (M) EDT 50ml,,,96,€11.90,lev23.27,lev36.30,,34.49,,,,,,,,,,,,,,,
Парфюми ,30292,3386460101844.0,Clean EU,Karl Lagerfeld,Karl Lagerfeld Bois De Yuzu (M) EDT 50ml,,,67,€11.90,lev23.27,lev30.10,,30.26 ⚠️ Too Low!,,,,,,,,,,,,,,,
Парфюми ,41341,3386460161619.0,Clean EU,Karl Lagerfeld,Karl Lagerfeld Bois Santal (M) EDT 50ml,,,115,€11.90,lev23.27,lev37.00,,35.15,,,,,,,,,,,,,,,
Парфюми ,41339,3386460161572.0,Clean EU,Karl Lagerfeld,Karl Lagerfeld Fleur D Iris (L) EDP 50ml,,,60,€11.90,lev23.27,lev30.60,,30.26,,,,,,,,,,,,,,,
Парфюми ,14304,3386460101868.0,Clean EU,Karl Lagerfeld,Karl Lagerfeld Fleur De Murier (L) EDP 50ml,,,54,€11.90,lev23.27,lev27.50,,30.26 ⚠️ Too Low!,,,,,,,,,,,,,,,
Парфюми ,41261,3386460133821.0,Clean EU,Karl Lagerfeld,Karl Lagerfeld Fleur De Pivoine (L) EDP 50ml,,,94,€11.90,lev23.27,lev28.80,,30.26 ⚠️ Too Low!,,,,,,,,,,,,,,,
Парфюми ,14372,3386461519457.0,Clean EU,Lanvin,Lanvin Eclat D Arpege (L) EDP 30ml,,,260,€11.90,lev23.27,lev31.90,,30.31,,,,,,,,,,,,,,,
Козметика,36891,602004106667.0,Clean EU,Benefit,Benefit Gogo Tint Cherry 6ml,,,425,€11.90,lev23.27,lev37.70,,35.82,,,,,,,,,,,,,,,
Грижа за кожата,6682,20714291822.0,Clean EU,Clinique,Clinique Anti Blemish Solutions Cleansing Foam- All Skin Types 125ml,,,2,€11.90,lev23.27,-,,No data,,,,,,,,,,,,,,,
Грижа за кожата,33276,641628501304.0,Clean EU,Elemis,Elemis Herbal Lavender Repair Mask 75ml,,,125,€11.90,lev23.27,lev37.70,,35.82,,,,,,,,,,,,,,,
Парфюми ,35372,6294015101591.0,Clean EU,Armaf,Armaf Shades Blue (M) EDT 100ml,,,5,€11.95,lev23.37,lev28.48,,30.38 ⚠️ Too Low!,,,,,,,,,,,,,,,
Душ гел,36500,3386460077019.0,Clean EU,Rochas,Rochas Eau De Rochas SG 500ml,,,76,€11.95,lev23.37,-,,No data,,,,,,,,,,,,,,,
Парфюми ,32093,3386460101875.0,Tester,Karl Lagerfeld,Karl Lagerfeld Bois De Yuzu (M) EDT 100ml Tester,,,12,€12.50,lev24.45,lev39.00,,37.05,,,,,,,,,,,,,,,
Парфюми ,31426,3386460124508.0,Tester,Karl Lagerfeld,Karl Lagerfeld Karl Hamburg Alster (M) EDP 100ml Tester,,,12,€12.50,lev24.45,lev39.00,,37.05,,,,,,,,,,,,,,,
Парфюми ,31428,3386460115629.0,Tester,Karl Lagerfeld,Karl Lagerfeld Karl New York Mercer Street (M) EDT 100ml Tester,,,12,€12.50,lev24.45,lev37.70,,35.82,,,,,,,,,,,,,,,
Парфюми ,41948,3386460130080.0,Tester,Karl Lagerfeld,Karl Lagerfeld Karl Vienna Opera (M) EDT 100ml Tester,,,12,€12.50,lev24.45,lev39.00,,37.05,,,,,,,,,,,,,,,
Парфюми ,14024,3386460032704.0,Clean EU,Montblanc,Montblanc Legend (M) EDT 30ml,,,509,€12.50,lev24.45,lev39.00,,37.05,,,,,,,,,,,,,,,
Продукти за тяло,37034,3386460121590.0,Clean EU,Jimmy Choo,Jimmy Choo I Want Choo (L) BL 150ml,,,45,€12.50,lev24.45,lev43.00,,40.85,,,,,,,,,,,,,,,
Парфюми ,14126,3386460066099.0,Clean EU,Boucheron,Boucheron Quatre (L) EDP 30ml,,,180,€12.90,lev25.23,lev41.00,,38.95,,,,,,,,,,,,,,,
Парфюми ,37922,85715950093.0,Clean EU,DKNY,DKNY Be Delicious Fresh Blossom (L) EDP 50ml,,,60,€12.90,lev25.23,lev41.99,,39.89,,,,,,,,,,,,,,,
Козметика – За мъже,33233,20714672072.0,Clean EU,Clinique,Clinique For Men Face Wash 200ml,,,65,€12.90,lev25.23,lev48.00,,45.41,,,,,,,,,,,,,,,
Продукти за тяло,14183,3386460077002.0,Clean EU,Rochas,Rochas Eau De Rochas BL 500ml,,,65,€13.00,lev25.43,-,,No data,,,,,,,,,,,,,,,
Грим,35689,602004095343.0,Clean EU,Benefit,Benefit Gimme Brow Shade 2 - Warm Golden Blonde 3g,,,165,€13.50,lev26.40,-,,No data,,,,,,,,,,,,,,,
Козметика,37181,602004095367.0,Clean EU,Benefit,Benefit Gimme Brow Shade 4 - Warm Deep Brown 3g,,,45,€13.75,lev26.89,-,,No data,,,,,,,,,,,,,,,
Парфюми ,13988,3386460010405.0,Clean EU,Lanvin,Lanvin Jeanne (L) EDP 50ml,,,72,€13.90,lev27.19,lev45.40,,43.13,,,,,,,,,,,,,,,
Парфюми ,37544,3386460079150.0,Clean EU,Coach,Coach Coach (L) EDT 30ml,,,600,€13.95,lev27.28,lev43.40,,41.23,,,,,,,,,,,,,,,
Парфюми ,32900,6294015102260.0,Clean EU,Armaf,Armaf Ventana (M) EDP 100ml,,,27,€14.50,lev28.36,lev36.99,,36.87,,,,,,,,,,,,,,,
Парфюми ,35513,3386460129411.0,Clean EU,Boucheron,Boucheron Quatre Iconic (L) EDP 30ml,,,30,€14.50,lev28.36,lev35.70,,36.87 ⚠️ Too Low!,,,,,,,,,,,,,,,
Парфюми ,37445,3386460078320.0,Clean EU,Coach,Coach Coach (L) EDP 30ml,,,102,€14.50,lev28.36,lev43.95,,41.75,,,,,,,,,,,,,,,
Парфюми ,41780,3386460142199.0,Clean EU,Coach,Coach Love (L) EDP 30ml,,New,600,€14.50,lev28.36,lev45.90,,43.61,,,,,,,,,,,,,,,
Парфюми ,35824,8011003845682.0,CLN,Dsquared2,Dsquared2 Wood For Him (M) EDT 30ml,,,4,€14.50,lev28.36,lev43.50,,41.33,,,,,,,,,,,,,,,
Парфюми ,41340,3386460161602.0,Clean EU,Karl Lagerfeld,Karl Lagerfeld Bois Santal (M) EDT 100ml,,,120,€14.50,lev28.36,lev46.10,,43.80,,,,,,,,,,,,,,,
Парфюми ,41338,3386460161565.0,Clean EU,Karl Lagerfeld,Karl Lagerfeld Fleur D Iris (L) EDP 100ml,,,120,€14.50,lev28.36,lev49.00,,46.55,,,,,,,,,,,,,,,
Парфюми ,37355,3386460135832.0,Clean EU,Montblanc,Montblanc Explorer Platinum (M) EDP 30ml,,,240,€14.50,lev28.36,lev49.00,,46.55,,,,,,,,,,,,,,,
Грим,32038,602004103123.0,Clean EU,Benefit,Benefit Gimme Brow Shade 3 - Neutral Light Brown 3g,,,45,€14.50,lev28.36,lev27.60,,36.87 ⚠️ Too Low!,,,,,,,,,,,,,,,
Грим,35703,602004071248.0,Clean EU,Benefit,Benefit Goof Proof Brow Pencil 02 Light 0.34g,,,122,€14.50,lev28.36,lev42.30,,40.19,,,,,,,,,,,,,,,
Грим,7870,602004039200.0,Clean EU,Benefit,Benefit They Re Real Mascara 8.5g,,,183,€14.50,lev28.36,-,,No data,,,,,,,,,,,,,,,
Парфюми ,814,737052031415.0,Clean EU,Boss,Boss Dark Blue (M) EDT 75ml,,,600,€14.90,lev29.14,lev43.10,,40.95,,,,,,,,,,,,,,,
Парфюми ,7333,27131017752.0,Clean EU,Estee Lauder,Estee Lauder Youth Dew (L) EDP 67ml,,,112,€14.90,lev29.14,lev40.10,,38.10,,,,,,,,,,,,,,,
Парфюми ,41369,3386460149433.0,CLN,Lacoste,Lacoste Pour Femme (L) EDP 30ml,,,180,€14.90,lev29.14,lev40.80,,38.76,,,,,,,,,,,,,,,
Грижа за кожата,35189,4020829005198.0,Clean EU,Dr. Hauschka,Dr. Hauschka Facial Toner 100ml,,,480,€14.90,lev29.14,lev50.00,,47.50,,,,,,,,,,,,,,,
Парфюми ,38352,6294015102642.0,Clean EU,Armaf,Armaf Club De Nuit Urban (M) EDP 105ml,,,10,€14.95,lev29.24,lev54.80,,52.06,,,,,,,,,,,,,,,
Парфюми ,38133,3386460134712.0,Clean EU,S.T. Dupont,Dupont Exceptional (M) EDP 100ml,,,258,€15.00,lev29.34,lev48.99,,46.54,,,,,,,,,,,,,,,
Парфюми ,39907,7640365140916.0,Clean EU,Philipp Plein,Philipp Plein Fatale Rose (L) EDP 30ml,,,4,€15.25,lev29.83,lev53.90,,51.21,,,,,,,,,,,,,,,
Парфюми ,32508,3614272916203.0,Tester,Cacharel,Cacharel Yes I Am Fabulous (L) EDP 50ml Tester,,,17,€15.50,lev30.31,lev56.00,,53.20,,,,,,,,,,,,,,,
Парфюми ,3472,3414202011752.0,Clean EU,Davidoff,Davidoff Cool Water (L) EDT 100ml,,,720,€15.50,lev30.31,lev43.80,,41.61,,,,,,,,,,,,,,,
Парфюми ,18909,8005610516134.0,Clean EU,Escada,Escada Celebrate N.O.W. (L) EDP 80ml,,,12,€15.50,lev30.31,lev47.99,,45.59,,,,,,,,,,,,,,,
Парфюми ,14088,3386460059114.0,Clean EU,Karl Lagerfeld,Karl Lagerfeld (L) EDP 85ml,,New_,120,€15.50,lev30.31,lev39.80,,39.41,,,,,,,,,,,,,,,
Парфюми ,14092,3386460059183.0,Clean EU,Karl Lagerfeld,Karl Lagerfeld (M) EDT 100ml,,New_,120,€15.50,lev30.31,lev40.30,,39.41,,,,,,,,,,,,,,,
Парфюми ,40755,3386460133869.0,Clean EU,Karl Lagerfeld,Karl Lagerfeld Bois De Cypres (M) EDT 100ml,,,120,€15.50,lev30.31,lev42.70,,40.57,,,,,,,,,,,,,,,
Парфюми ,14253,3386460087261.0,Clean EU,Karl Lagerfeld,Karl Lagerfeld Bois De Vetiver (M) EDT 100ml,,,96,€15.50,lev30.31,lev39.30,,39.41 ⚠️ Too Low!,,,,,,,,,,,,,,,
Парфюми ,14302,3386460101837.0,Clean EU,Karl Lagerfeld,Karl Lagerfeld Bois De Yuzu (M) EDT 100ml,,,60,€15.50,lev30.31,lev41.80,,39.71,,,,,,,,,,,,,,,
Парфюми ,14303,3386460101851.0,Clean EU,Karl Lagerfeld,Karl Lagerfeld Fleur De Murier (L) EDP 100ml,,,90,€15.50,lev30.31,lev40.20,,39.41,,,,,,,,,,,,,,,
Парфюми ,41260,3386460133814.0,Clean EU,Karl Lagerfeld,Karl Lagerfeld Fleur De Pivoine (L) EDP 100ml,,,120,€15.50,lev30.31,lev40.60,,39.41,,,,,,,,,,,,,,,
Парфюми ,41797,3386460160292.0,Clean EU,Karl Lagerfeld,Karl Lagerfeld Jeans Urban Blue (M) EDT 100ml,,,48,€15.50,lev30.31,lev42.40,,40.28,,,,,,,,,,,,,,,
Парфюми ,41798,3386460160193.0,Clean EU,Karl Lagerfeld,Karl Lagerfeld Jeans Urban Pink (L) EDP 100ml,,,36,€15.50,lev30.31,lev41.70,,39.62,,,,,,,,,,,,,,,
Парфюми ,31425,3386460124485.0,Clean EU,Karl Lagerfeld,Karl Lagerfeld Karl Hamburg Alster (M) EDT 100ml,,,109,€15.50,lev30.31,lev43.99,,41.79,,,,,,,,,,,,,,,
Парфюми ,31427,3386460115551.0,Clean EU,Karl Lagerfeld,Karl Lagerfeld Karl New York Mercer Street (M) EDT 100ml,,,90,€15.50,lev30.31,lev41.80,,39.71,,,,,,,,,,,,,,,
Парфюми ,31429,3386460115544.0,Clean EU,Karl Lagerfeld,Karl Lagerfeld Karl Paris 21 Rue Saint Guillaume (L) EDP 100ml,,,111,€15.50,lev30.31,lev44.90,,42.66,,,,,,,,,,,,,,,
Парфюми ,41342,3386460130011.0,Clean EU,Karl Lagerfeld,Karl Lagerfeld Karl Rome Divino Amore (L) EDP 100ml,,,57,€15.50,lev30.31,lev45.60,,43.32,,,,,,,,,,,,,,,
Парфюми ,31431,3386460124430.0,Clean EU,Karl Lagerfeld,Karl Lagerfeld Karl Tokyo Shibuya (L) EDP 100ml,,,34,€15.50,lev30.31,lev40.40,,39.41,,,,,,,,,,,,,,,
Парфюми ,41343,3386460130066.0,Clean EU,Karl Lagerfeld,Karl Lagerfeld Karl Vienna Opera (M) EDT 100ml,,,89,€15.50,lev30.31,lev60.40,,54.57,,,,,,,,,,,,,,,
Парфюми ,14368,3386461515688.0,Clean EU,Lanvin,Lanvin Eclat D Arpege (L) EDP 50ml,,,480,€15.50,lev30.31,lev47.00,,44.65,,,,,,,,,,,,,,,
Парфюми ,14296,3386460101059.0,Clean EU,Montblanc,Montblanc Explorer (M) EDP 30ml,,,600,€15.50,lev30.31,lev48.00,,45.60,,,,,,,,,,,,,,,
Парфюми ,32253,3386460125130.0,Tester,Rochas,Rochas Girl (L) EDT 100ml Tester,,,11,€15.50,lev30.31,lev38.99,,39.41 ⚠️ Too Low!,,,,,,,,,,,,,,,
Козметика,37433,4020829080614.0,Clean EU,Dr. Hauschka,Dr. Hauschka Balancing Day Lotion 50ml,,,12,€15.50,lev30.31,lev53.00,,50.35,,,,,,,,,,,,,,,
Грижа за кожата,9082,768614145288.0,Clean EU,Shiseido,Shiseido Essentials Cleansing Mousse 125ml,,,720,€15.50,lev30.31,lev54.00,,51.30,,,,,,,,,,,,,,,
Парфюми ,38849,88300104437.0,Clean EU,CK,CK Be (U) EDT 200ml,,,102,€15.90,lev31.10,lev63.99,,55.97,,,,,,,,,,,,,,,
Парфюми ,32990,3349668609031.0,Clean EU,Paco Rabanne,Paco Rabanne Paco (M) EDT 100ml,,,600,€15.90,lev31.10,lev49.99,,47.49,,,,,,,,,,,,,,,
Парфюми ,28787,3386460076401.0,Tester,Rochas,Rochas Man (M) EDT 100ml Tester,,,16,€15.90,lev31.10,lev47.99,,45.59,,,,,,,,,,,,,,,
Грижа за кожата,8497,729238143418.0,Clean EU,Shiseido,Shiseido Perfect Cleansing Oil 180ml,,,106,€15.90,lev31.10,lev56.69,,53.86,,,,,,,,,,,,,,,
Парфюми ,7338,27131043294.0,Clean EU,Estee Lauder,Estee Lauder Pleasures (L) EDP 50ml,,,49,€15.95,lev31.20,lev43.40,,41.23,,,,,,,,,,,,,,,
Парфюми ,7340,27131086864.0,Clean EU,Estee Lauder,Estee Lauder Beautiful (L) EDP 30ml,,,51,€16.00,lev31.29,lev45.90,,43.61,,,,,,,,,,,,,,,
Душ гел,40648,8435415007573.0,Clean EU,JPG,JPG Scandal (L) SG 200ml,,,18,€16.25,lev31.78,lev47.30,,44.94,,,,,,,,,,,,,,,
Парфюми ,28757,3386460036450.0,Tester,Boucheron,Boucheron Boucheron Pour Homme (M) EDP 100ml Tester,,,33,€16.50,lev32.27,lev42.99,,41.95,,,,,,,,,,,,,,,
Парфюми ,28659,3360373063741.0,Tester,Cacharel,Cacharel Amor Amor (L) EDT 100ml Tester,,,209,€16.50,lev32.27,lev41.99,,41.95,,,,,,,,,,,,,,,
Парфюми ,7385,27131521433.0,Clean EU,Estee Lauder,Estee Lauder Pleasures (M) EDC 100ml,,,31,€16.50,lev32.27,lev36.80,,41.95 ⚠️ Too Low!,,,,,,,,,,,,,,,
Парфюми ,18707,7640111498544.0,Clean EU,Lalique,Lalique Satine (L) EDP 100ml,,New_,12,€16.50,lev32.27,lev46.70,,44.37,,,,,,,,,,,,,,,
Парфюми ,30748,3386460113601.0,Clean EU,Montblanc,Montblanc Signature (L) EDP 30ml,,,480,€16.50,lev32.27,lev46.99,,44.64,,,,,,,,,,,,,,,
Парфюми ,36618,8058045425625.0,CLN,Trussardi,Trussardi (L) EDP 30ml,,,16,€16.50,lev32.27,lev46.90,,44.56,,,,,,,,,,,,,,,
Парфюми ,38446,8058045436614.0,CLN,Trussardi,Trussardi Ruby Red (L) EDP 30ml,,,48,€16.50,lev32.27,lev50.00,,47.50,,,,,,,,,,,,,,,
Парфюми ,3468,3414202000572.0,Clean EU,Davidoff,Davidoff Cool Water (M) EDT 125ml,,New_,120,€16.90,lev33.05,lev56.00,,53.20,,,,,,,,,,,,,,,
Парфюми ,30865,8011003845774.0,Tester,Dsquared2,Dsquared2 Wood For Him (M) EDT 100ml Tester,,,332,€16.90,lev33.05,lev51.99,,49.39,,,,,,,,,,,,,,,
Парфюми ,39696,3386460144254.0,Clean EU,Montblanc,Montblanc Legend Blue (M) EDP 30ml,,,120,€16.90,lev33.05,lev48.99,,46.54,,,,,,,,,,,,,,,
Грижа за кожата,29776,768614145295.0,Clean EU,Shiseido,Shiseido Clarifyng Cleansing Foam 125ml,,,560,€16.90,lev33.05,lev46.20,,43.89,,,,,,,,,,,,,,,
Парфюми ,6613,20714156893.0,Clean EU,Clinique,Clinique Happy (L) EDP 100ml,,,480,€16.95,lev33.15,lev55.00,,52.25,,,,,,,,,,,,,,,
Парфюми ,28755,3386460036375.0,Tester,Boucheron,Boucheron Boucheron (L) EDP 100ml Tester,,,36,€17.50,lev34.23,lev72.90,,61.61,,,,,,,,,,,,,,,
Парфюми ,37353,3386460113731.0,Tester,Coach,Coach Blue Men (M) EDT 100ml Tester,,,90,€17.50,lev34.23,lev60.00,,57.00,,,,,,,,,,,,,,,
Парфюми ,30353,3386460086363.0,Tester,Coach,Coach Man (M) EDT 100ml Tester,,,98,€17.50,lev34.23,lev79.90,,61.61,,,,,,,,,,,,,,,
Парфюми ,37130,3386460126601.0,Tester,Coach,Coach Wild Rose (L) EDP 90ml Tester,,,30,€17.50,lev34.23,lev64.00,,60.80,,,,,,,,,,,,,,,
Парфюми ,15031,3454960021679.0,Clean EU,Lalique,Lalique Perles De Lalique (L) EDP 100ml,,New_,6,€17.50,lev34.23,lev47.80,,45.41,,,,,,,,,,,,,,,
Парфюми ,28784,3386460076289.0,Tester,Rochas,Rochas Eau De Rochas (L) EDT 100ml Tester,,,72,€17.50,lev34.23,lev39.99,,44.49 ⚠️ Too Low!,,,,,,,,,,,,,,,
Козметика,38083,192333074640.0,Clean EU,Clinique,Clinique Superbalanced Makeup CN90 Sand 30ml,,,23,€17.50,lev34.23,lev65.19,,61.61,,,,,,,,,,,,,,,
Грижа за кожата,36491,4020829007284.0,Clean EU,Dr. Hauschka,Dr. Hauschka Soothing Mask 30ml,,,18,€17.50,lev34.23,lev36.34,,44.49 ⚠️ Too Low!,,,,,,,,,,,,,,,
Грим,31258,607845012368.0,Clean EU,Nars,Nars Radiant Creamy Concealer - Biscuit MD1 6ml,,,48,€17.50,lev34.23,-,,No data,,,,,,,,,,,,,,,
Грим,31257,607845012375.0,Clean EU,Nars,Nars Radiant Creamy Concealer - Caramel MD2 6ml,,,48,€17.50,lev34.23,lev24.48,,44.49 ⚠️ Too Low!,,,,,,,,,,,,,,,
Грим,31255,607845012351.0,Clean EU,Nars,Nars Radiant Creamy Concealer - Ginger M2 6ml,,,9,€17.50,lev34.23,-,,No data,,,,,,,,,,,,,,,
Парфюми ,37045,3386460137614.0,Tester,Jimmy Choo,Jimmy Choo Rose Passion EDP 100ml Tester,,,321,€17.75,lev34.72,lev46.70,,45.13,,,,,,,,,,,,,,,
Парфюми ,28775,3386460066167.0,Tester,Boucheron,Boucheron Quatre (M) EDT 100ml Tester,,,7,€17.90,lev35.01,lev48.99,,46.54,,,,,,,,,,,,,,,
Парфюми ,36474,3386460135184.0,Clean EU,Boucheron,Boucheron Singulier (M) EDP 50ml,,,32,€17.90,lev35.01,lev54.99,,52.24,,,,,,,,,,,,,,,
Парфюми ,42046,3360374507206.0,CLN,Cacharel,Cacharel Anais Anais L Original (L) EDT 50ml,,,60,€17.90,lev35.01,lev48.99,,46.54,,,,,,,,,,,,,,,
Парфюми ,39399,3614273566612.0,Tester,Diesel,Diesel Fuel For Life (M) EDT 125ml Tester,,,60,€17.90,lev35.01,lev49.00,,46.55,,,,,,,,,,,,,,,
Парфюми ,28832,3386461515701.0,Tester,Lanvin,Lanvin Eclat D Arpege (L) EDP 100ml Tester,,,50,€17.90,lev35.01,lev55.90,,53.11,,,,,,,,,,,,,,,
Грижа за кожата,6768,20714462727.0,Clean EU,Clinique,Clinique Clarifying Lotion 2 - Dry To Combination 400ml,,,720,€17.90,lev35.01,-,,No data,,,,,,,,,,,,,,,
Грижа за кожата,6636,20714222857.0,Clean EU,Clinique,Clinique Dramatically Different Moisturizing Gel 125ml,,,360,€17.90,lev35.01,lev62.32,,59.20,,,,,,,,,,,,,,,
Парфюми ,31989,6085010044712.0,Clean EU,Armaf,Armaf Club De Nuit Intense Man (M) EDT 105ml,,,960,€17.95,lev35.11,lev48.80,,46.36,,,,,,,,,,,,,,,
Парфюми ,14125,3386460066082.0,Clean EU,Boucheron,Boucheron Quatre (L) EDP 50ml,,,240,€17.95,lev35.11,lev55.00,,52.25,,,,,,,,,,,,,,,
Парфюми ,39100,3614273962391.0,CLN,Azzaro,Azzaro Chrome Legend (M) EDT 100ml,,,170,€18.00,lev35.20,lev55.19,,52.43,,,,,,,,,,,,,,,
Парфюми ,35836,8011003852734.0,CLN,Dsquared2,Dsquared2 Green Wood (M) EDT 50ml,,,21,€18.00,lev35.20,lev54.60,,51.87,,,,,,,,,,,,,,,
Парфюми ,41237,3351500011506.0,Tester,Azzaro,Azzaro Pour Homme (M) EDT 100ml Tester,,,45,€18.50,lev36.18,lev51.00,,48.45,,,,,,,,,,,,,,,
Парфюми ,28759,3386460036542.0,Tester,Boucheron,Boucheron Jaipur (M) EDP 100ml Tester,,,42,€18.50,lev36.18,lev45.00,,47.04 ⚠️ Too Low!,,,,,,,,,,,,,,,
Парфюми ,37550,3386460079167.0,Tester,Coach,Coach Coach (L) EDT 90ml Tester,,,131,€18.50,lev36.18,lev56.00,,53.20,,,,,,,,,,,,,,,
Парфюми ,37467,801100387131565.0,Tester,Dsquared2,Dsquared2 2 Wood (U) EDT 100ml Tester,,,85,€18.50,lev36.18,lev65.00,,61.75,,,,,,,,,,,,,,,
Парфюми ,38312,3423222090715.0,CLN,Issey Miyake,Issey Miyake L Eau D Issey Vetiver (M) EDT 50ml,,,3,€18.50,lev36.18,lev71.00,,65.13,,,,,,,,,,,,,,,
Парфюми ,36501,3386460129893.0,Clean EU,Jimmy Choo,Jimmy Choo I Want Choo Forever (L) EDP 40ml,,,120,€18.50,lev36.18,lev68.00,,64.60,,,,,,,,,,,,,,,
Парфюми ,28754,3386460032742.0,Tester,Montblanc,Montblanc Legend (M) EDT 100ml Tester,,,240,€18.50,lev36.18,lev56.00,,53.20,,,,,,,,,,,,,,,
Парфюми ,37247,8011003838110.0,Tester,Moschino,Moschino Pink Fresh Couture (L) EDT 100ml Tester,,,18,€18.50,lev36.18,lev54.99,,52.24,,,,,,,,,,,,,,,
Парфюми ,14311,3386460103008.0,Clean EU,Rochas,Rochas Byzance (L) EDP 60ml,,,48,€18.50,lev36.18,lev62.00,,58.90,,,,,,,,,,,,,,,
Парфюми ,42163,3423474896059.0,Clean EU,Zadig & Voltaire,Zadig & Voltaire This Is Him (M) EDT 30ml,,New_,12,€18.50,lev36.18,lev56.40,,53.58,,,,,,,,,,,,,,,
Грим,37988,192333074633.0,Clean EU,Clinique,Clinique Superbalanced Makeup CN62 Porcelain Beige 30ml,,,3,€18.50,lev36.18,lev53.55,,50.87,,,,,,,,,,,,,,,
Парфюми ,33265,6294015132120.0,Clean EU,Armaf,Armaf Club De Nuit Milestone (U) EDP 105ml,,,306,€18.90,lev36.96,lev54.90,,52.16,,,,,,,,,,,,,,,
Парфюми ,33047,3386460119276.0,Clean EU,Jimmy Choo,Jimmy Choo I Want Choo (L) EDP 40ml,,,480,€18.90,lev36.96,lev69.00,,65.55,,,,,,,,,,,,,,,
Парфюми ,37246,8011003826766.0,Tester,Moschino,Moschino Fresh Couture (L) EDT 100ml Tester,,,36,€18.90,lev36.96,lev53.00,,50.35,,,,,,,,,,,,,,,
Козметика,36888,3614270366215.0,Clean EU,Biotherm,Biotherm Aquasource Cream NC 50ml,,,76,€18.90,lev36.96,lev71.00,,66.54,,,,,,,,,,,,,,,
Парфюми ,32899,6294015136470.0,Clean EU,Armaf,Armaf Club De Nuit Sillage (M) EDP 105ml,,,146,€19.00,lev37.16,lev54.90,,52.16,,,,,,,,,,,,,,,
Парфюми ,34641,3614227748408.0,Tester,Burberry,Burberry Weekend (L) EDP 100ml Tester,,,59,€19.00,lev37.16,lev59.00,,56.05,,,,,,,,,,,,,,,
Парфюми ,28658,3360373016402.0,Tester,Cacharel,Cacharel Noa (L) EDT 100ml Tester,,,44,€19.00,lev37.16,lev59.00,,56.05,,,,,,,,,,,,,,,
Парфюми ,38970,8011003847044.0,Tester,Dsquared2,Dsquared2 Wood For Him (M) EDT 100ml NC,,,50,€19.00,lev37.16,lev72.70,,66.89,,,,,,,,,,,,,,,
Парфюми ,36447,27131595045.0,Clean EU,Estee Lauder,Estee Lauder Sensuous (L) EDP 50ml,,,86,€19.00,lev37.16,lev54.00,,51.30,,,,,,,,,,,,,,,
Парфюми ,31382,8011003838226.0,Tester,Moschino,Moschino Gold Fresh Couture (L) EDP 100ml Tester,,,60,€19.25,lev37.65,lev89.00,,67.77,,,,,,,,,,,,,,,
Парфюми ,37128,3386460113106.0,Tester,Coach,Coach Dreams (L) EDP 90ml Tester,,,85,€19.50,lev38.14,lev59.00,,56.05,,,,,,,,,,,,,,,
Парфюми ,30352,3386460095372.0,Tester,Coach,Coach Floral (L) EDP 90ml Tester,,,16,€19.50,lev38.14,lev77.00,,68.65,,,,,,,,,,,,,,,
Парфюми ,37468,8011003852796.0,Tester,Dsquared2,Dsquared2 Red Wood (L) EDT 100ml Tester,,,234,€19.50,lev38.14,lev50.99,,49.58,,,,,,,,,,,,,,,
Парфюми ,36318,7640233340202.0,Clean EU,Elie Saab,Elie Saab Girl Of Now Forever (L) EDP 30ml,,,128,€19.50,lev38.14,lev57.90,,55.01,,,,,,,,,,,,,,,
Парфюми ,28749,3386460025812.0,Tester,Jimmy Choo,Jimmy Choo (L) EDP 100ml Tester,,,8,€19.50,lev38.14,lev56.10,,53.30,,,,,,,,,,,,,,,
Парфюми ,41295,22548366455.0,CLN,Michael Kors,Michael Kors Wonderlust (L) EDP 50ml,,,44,€19.50,lev38.14,lev62.99,,59.84,,,,,,,,,,,,,,,
Парфюми ,37761,8011003872893.0,Tester,Dsquared2,Dsquared2 Original Wood (M) EDP 100ml Tester NC,,,24,€19.90,lev38.92,lev53.99,,51.29,,,,,,,,,,,,,,,
Парфюми ,36471,7640233341056.0,Clean EU,Elie Saab,Elie Saab Girl Of Now Lovely (L) EDP 30ml,,,9,€19.90,lev38.92,lev58.90,,55.96,,,,,,,,,,,,,,,
